paper_id,reviewer_id,review_content
10.1109/ICEDCS60513.2023.00131,55822747800,Science allow pass effect machine popular.
10.1109/ICEDCS60513.2023.00131,55417848300,Character provide I would fill.
10.1007/s11042-023-15959-w,58890084500,Around design sort others federal.
10.1007/s11042-023-15959-w,6701728917,Someone imagine program city a onto fall.
10.1007/s11042-023-15959-w,35264335800,Establish against year food set.
10.1109/ACII59096.2023.10388135,56597530900,Western data court prevent.
10.1109/ACII59096.2023.10388135,57426113900,Throw street white soldier down right guess.
10.1109/ACII59096.2023.10388135,25825503500,Watch no never agency enter forward with.
10.1109/BIOSIG58226.2023.10345994,57884306400,Note order different change.
10.1109/BIOSIG58226.2023.10345994,58360091200,Technology option purpose state.
10.1109/BIOSIG58226.2023.10345994,57203130515,Interesting population film our oil perform.
10.1007/s11042-023-15714-1,58864835800,Through network idea go tell cause.
10.1007/s11042-023-15714-1,58026522600,They that expert increase.
10.1007/s11042-023-15714-1,57203001033,Weight doctor class them health to month.
10.1145/3595360.3595853,58459893100,Than nothing result raise low home through.
10.1145/3595360.3595853,35769748800,Professional themselves add group.
10.1145/3595360.3595853,54974129600,Hand lay organization before test I from likely.
,58339054000,Necessary pressure affect head thus say class.
,8856653600,Night experience them watch.
,58903743500,His ever sense. By beyond especially share.
10.1145/3620678.3624656,57268111900,Because physical discuss. Him must draw with.
10.1145/3620678.3624656,57220310916,Later feeling four you month every.
10.1145/3620678.3624656,57283703900,Rate answer property.
10.1016/j.ins.2024.120262,58911604600,Among suggest power deep office down mind after.
10.1016/j.ins.2024.120262,55800543300,Yet spring tell.
10.1016/j.ins.2024.120262,7003391555,Share save here positive.
10.1109/TII.2023.3297139,57212934197,Wrong personal glass suffer stuff material.
10.1109/TII.2023.3297139,55265130000,Plan finally real stay your.
10.1109/TII.2023.3297139,57408665500,Design section suddenly difference.
10.1109/ICIC60109.2023.10381942,58934119300,Use hundred floor impact challenge car.
10.1109/ICIC60109.2023.10381942,58817885100,Else finish girl into three kid all.
10.1109/ICIC60109.2023.10381942,57295738100,Food reach part PM he behind plan.
10.1109/MICC59384.2023.10419720,55863910100,Wife firm on social. Father idea despite.
10.1109/MICC59384.2023.10419720,57220189075,Professor require vote bar.
10.1109/MICC59384.2023.10419720,56144702700,Few task over any plant.
10.1109/ICDACAI59742.2023.00127,53264599300,Allow now method year measure born.
10.1109/ICDACAI59742.2023.00127,58137753400,Southern because drug.
10.1109/ICDACAI59742.2023.00127,57883556700,Money happy early foot gun sound no talk.
10.1016/j.sasc.2023.200070,36810072800,Risk back consumer trade value.
10.1016/j.sasc.2023.200070,57220011737,Office study military card month yard then then.
10.1016/j.sasc.2023.200070,57201132764,Budget believe board amount.
10.1109/AMCAI59331.2023.10431516,57713631900,Already happen huge a well.
10.1109/AMCAI59331.2023.10431516,57193576827,Security performance purpose sister.
10.1109/AMCAI59331.2023.10431516,57274970100,Pass fear final their. Peace process never sense.
10.4230/LIPIcs.ICDT.2024.20,57202394314,Available level project. Yes course before.
10.4230/LIPIcs.ICDT.2024.20,55841653800,Consider about cell stop yet how whatever test.
10.4230/LIPIcs.ICDT.2024.20,56039225700,Sign rich onto work mention pressure.
10.1145/3570991.3571009,57761347700,Meeting second language full.
10.1145/3570991.3571009,57426113900,Lead of wrong court Mrs I natural once.
10.1145/3570991.3571009,36680201800,Hot partner customer much audience suffer.
10.1016/j.media.2024.103087,57003736200,Everybody away nation feeling.
10.1016/j.media.2024.103087,13403686900,Edge body opportunity movement safe both billion.
10.1016/j.media.2024.103087,58541690800,Security office hard son throw whose.
10.1145/3545947.3576350,57219526654,Produce well this break realize manager.
10.1145/3545947.3576350,58911604600,Company dog recently teach.
10.1145/3545947.3576350,57214357856,Peace white everybody financial dream.
10.1109/CATS58046.2023.10424267,56202305300,Seat type church window.
10.1109/CATS58046.2023.10424267,57221085999,Deal in edge scientist trip create.
10.1109/CATS58046.2023.10424267,57222117369,Prove gun form during oil wonder fine.
10.1109/ACCESS.2024.3362294,58960905400,Shake every white theory.
10.1109/ACCESS.2024.3362294,58919595800,Building young become indeed.
10.1109/ACCESS.2024.3362294,36782771600,Rather level across stand may nice think.
10.1145/3592686.3592756,57208178055,West relate local risk. Mouth free finish five.
10.1145/3592686.3592756,58112466000,Least way major member significant happy program.
10.1145/3592686.3592756,57219531893,Could second between day some attention.
10.1109/TDSC.2023.3264567,57119398400,Southern amount wife eat side.
10.1109/TDSC.2023.3264567,7005780945,Hand skill it role so hold.
10.1109/TDSC.2023.3264567,56904156000,Thought specific cell central particular.
10.1109/3ICT60104.2023.10391650,58882685100,Or bad bag far do sure for.
10.1109/3ICT60104.2023.10391650,57711145100,Break increase middle do gun artist important.
10.1109/3ICT60104.2023.10391650,58921336500,Ready total would let along happen do scientist.
10.1016/j.engappai.2024.108036,57226772700,School talk once. Onto treat involve thank color.
10.1016/j.engappai.2024.108036,36895320900,Congress bit many trade story serious.
10.1016/j.engappai.2024.108036,58860586700,Tonight yeah thank full sort rise run.
,57210020258,Receive deep car town thousand project.
,58038754200,Husband early career box. Walk power human so.
,6508185861,Medical office indicate suddenly each.
10.1109/TNSE.2023.3300768,57191971731,Myself happen indeed right.
10.1109/TNSE.2023.3300768,56024313400,Tough arm meet south day get.
10.1109/TNSE.2023.3300768,57206263299,Say meeting pass always any check to.
10.1109/TMM.2023.3303725,57222163023,Citizen party military house.
10.1109/TMM.2023.3303725,57207601856,Carry next glass suggest lose.
10.1109/TMM.2023.3303725,55813479500,During picture article well.
10.1109/BigDIA60676.2023.10429411,6506803487,Try cell indicate foot mean bed way.
10.1109/BigDIA60676.2023.10429411,57945870700,Despite first glass season born a cultural.
10.1109/BigDIA60676.2023.10429411,7102985269,New really mission success against increase.
10.1145/3633512,58112466000,Never wide like only look include environment.
10.1145/3633512,58813187600,Focus president professional know.
10.1145/3633512,57204049333,Unit analysis which. Into worker serious city.
10.1145/3575693.3575699,58849679900,Member suddenly mouth.
10.1145/3575693.3575699,57211430431,Spring effect person while.
10.1145/3575693.3575699,58727377500,Remain more live audience history.
10.13052/jcsm2245-1439.1311,58835697900,Increase who low find hard manager mind.
10.13052/jcsm2245-1439.1311,57918140800,Protect see leg staff.
10.13052/jcsm2245-1439.1311,7402420191,Rich science music character center but no more.
10.1109/IMCOM60618.2024.10418292,57431346100,Whether fill reason movie cultural.
10.1109/IMCOM60618.2024.10418292,58145584000,Position church issue type. Task mouth support.
10.1109/IMCOM60618.2024.10418292,58963436800,Color win college kind.
10.1145/3597465.3605224,57956991300,Window school statement them cold.
10.1145/3597465.3605224,57382515500,Morning research fish where.
10.1145/3597465.3605224,57541422600,Certainly senior husband five central.
10.1016/j.ins.2024.120257,57219789172,Within represent will since hour.
10.1016/j.ins.2024.120257,56902540800,Rest until both interest.
10.1016/j.ins.2024.120257,57216410031,Fight production subject mention send move.
10.1016/j.bspc.2023.105823,22733268800,Control put establish. Couple find media.
10.1016/j.bspc.2023.105823,16479742300,Management budget behavior hear.
10.1016/j.bspc.2023.105823,57190487952,Prove present hope ok trouble technology reach.
10.1109/SmartCloud58862.2023.00020,58725013200,Into place adult campaign trouble phone.
10.1109/SmartCloud58862.2023.00020,8859945700,Table per eye history.
10.1109/SmartCloud58862.2023.00020,24476050500,Fear painting third a Republican same suffer.
10.1109/SUMMA60232.2023.10349480,58864835800,Analysis phone forward determine push.
10.1109/SUMMA60232.2023.10349480,56730051700,Bed imagine money responsibility government.
10.1109/SUMMA60232.2023.10349480,58086043000,They general bag morning us be strong.
10.1016/j.compag.2023.108500,57222103624,Relationship week against free.
10.1016/j.compag.2023.108500,58234727500,Camera take stay response close.
10.1016/j.compag.2023.108500,58763641300,Film talk issue.
10.1145/3638837.3638845,24924109600,Door assume PM generation fish land doctor.
10.1145/3638837.3638845,55550317000,Race painting speech point military herself car.
10.1145/3638837.3638845,56904366400,Job move same cut pick seven.
10.1145/3584371.3613022,57203772400,More book source deep figure image.
10.1145/3584371.3613022,8714192600,Second child that. Media pass decision spend.
10.1145/3584371.3613022,57683039300,Quickly position all.
10.1145/3555776.3577652,57203243422,Base spend cultural describe among.
10.1145/3555776.3577652,55851922500,Budget color successful learn.
10.1145/3555776.3577652,57215743365,Range follow ago individual area.
10.1016/j.specom.2024.103047,55042923700,Anything magazine usually star agreement time.
10.1016/j.specom.2024.103047,58481468100,Station purpose gun way material act.
10.1016/j.specom.2024.103047,57226847195,Tax begin structure low career.
10.1016/j.compbiomed.2024.108224,6603845144,Top western share too traditional you.
10.1016/j.compbiomed.2024.108224,57213066912,Although become check hard.
10.1016/j.compbiomed.2024.108224,57841490800,Alone understand serious.
10.3233/JIFS-232918,58112466000,Focus marriage soon.
10.3233/JIFS-232918,58904710400,Recent power industry college.
10.3233/JIFS-232918,7401957018,Money maintain cause public night.
10.1007/s11128-024-04346-5,7005065755,Include bed world. Along the contain figure.
10.1007/s11128-024-04346-5,14022951100,Build indeed economy.
10.1007/s11128-024-04346-5,55335280000,House mean glass lawyer. Foreign tough act.
10.1117/12.3021729,57221939879,Senior project civil. Prepare rule agree court.
10.1117/12.3021729,24492106800,Language market official authority traditional.
10.1117/12.3021729,22634069200,Middle gun man special. Allow option white.
10.1109/ICSIMA59853.2023.10373467,57203393579,Perform travel teacher capital point class.
10.1109/ICSIMA59853.2023.10373467,57218846945,Budget religious like because wonder.
10.1109/ICSIMA59853.2023.10373467,23035818200,Father do player field table.
10.1109/ICTBIG59752.2023.10456032,57200603870,Media weight mention part ten.
10.1109/ICTBIG59752.2023.10456032,58682135700,Religious cold sport actually why.
10.1109/ICTBIG59752.2023.10456032,56113815600,Hour nearly sell.
10.1109/TMI.2023.3302473,58883000000,Treat whose unit continue prove recognize.
10.1109/TMI.2023.3302473,55622054000,Front end sister girl collection.
10.1109/TMI.2023.3302473,36475885000,Set station mention important report.
10.1109/JIOT.2023.3327738,58940080400,News responsibility president reflect set middle.
10.1109/JIOT.2023.3327738,58950242600,Between opportunity ball.
10.1109/JIOT.2023.3327738,58411839200,Final stand decide friend.
10.1007/s11042-023-16508-1,14120320900,Over scientist free although religious.
10.1007/s11042-023-16508-1,13404674100,Culture herself TV nature current serious that.
10.1007/s11042-023-16508-1,57211925655,Environment product tonight fish yes two.
10.1145/3595360.3595858,7101719136,Season report movie third both table.
10.1145/3595360.3595858,57201682570,Feeling his power control.
10.1145/3595360.3595858,57222329683,Game American painting career program option PM.
10.1007/s00034-023-02544-7,23396672600,Represent they arrive child.
10.1007/s00034-023-02544-7,58966859000,Door leg alone building notice me.
10.1007/s00034-023-02544-7,57714858600,Test whom lawyer road street.
10.1016/j.bspc.2023.105793,57216690755,Low make sell argue deal.
10.1016/j.bspc.2023.105793,58132631900,Visit good base bag. Purpose campaign discover.
10.1016/j.bspc.2023.105793,58191930600,Visit travel maintain thus take.
10.1108/VJIKMS-09-2021-0222,58771087900,Participant account let likely source while tell.
10.1108/VJIKMS-09-2021-0222,57203393579,However white few myself hope.
10.1108/VJIKMS-09-2021-0222,58070682700,In vote choose arrive.
10.1016/j.dsm.2023.12.002,54392508000,Performance hit paper final same many open.
10.1016/j.dsm.2023.12.002,56183769400,Yourself front too condition.
10.1016/j.dsm.2023.12.002,55717945400,Very many position entire budget go.
10.1109/TAI.2024.3376319,56340229900,Drive top per.
10.1109/TAI.2024.3376319,55825347400,Begin throw sign hold site discuss goal.
10.1109/TAI.2024.3376319,57216941013,Suddenly provide seven area world fund effort.
10.1007/s11042-023-17854-w,57225034895,Major concern civil dinner high keep central.
10.1007/s11042-023-17854-w,58939671800,Tv actually key she billion begin young budget.
10.1007/s11042-023-17854-w,57991603800,Will audience join popular policy member.
10.1007/s11042-023-16066-6,57193280443,Doctor officer car manager middle building.
10.1007/s11042-023-16066-6,6603944444,Kind sing upon put citizen a drive.
10.1007/s11042-023-16066-6,22333554700,Couple stuff personal.
10.1109/SITA60746.2023.10373743,57210261874,Time miss partner no. Along edge front must.
10.1109/SITA60746.2023.10373743,56736147300,Attack TV attack pass.
10.1109/SITA60746.2023.10373743,57196154912,Finish main science relationship board anyone.
10.1016/j.iswa.2023.200320,57211430431,State physical stay shoulder assume how apply.
10.1016/j.iswa.2023.200320,7402006534,Night science soon between coach lawyer.
10.1016/j.iswa.2023.200320,57752346600,Whole sometimes girl wife product image.
,56712315000,Rest figure capital now.
,58808360400,Daughter project society think.
,50861109400,Their as find look.
10.1145/3584372.3588676,55417848300,Over case music view become very.
10.1145/3584372.3588676,57348012400,Address interview present director arm matter.
10.1145/3584372.3588676,57366497900,Task age cost yard road style.
10.1007/s00366-023-01813-y,58868513200,Be campaign least relate candidate yard.
10.1007/s00366-023-01813-y,58966859000,With economy example police against.
10.1007/s00366-023-01813-y,58875156600,Almost would wonder upon.
10.1145/3624717,35177461200,Race prevent woman language.
10.1145/3624717,57563379200,Relationship feeling right room our.
10.1145/3624717,15848147800,Only we others style chair send put.
10.1007/s12065-022-00800-4,58942416200,Yeah doctor evening difficult.
10.1007/s12065-022-00800-4,58705492000,Main threat develop whatever sign character show.
10.1007/s12065-022-00800-4,58771087900,Role day so list trade.
10.1145/3633053.3633059,58835272400,Drug deal run PM reason.
10.1145/3633053.3633059,57222488610,One tough American occur civil life pressure.
10.1145/3633053.3633059,57213786110,Chair visit opportunity foot.
10.1109/MITS.2023.3346842,57194474188,Democratic sit win consumer.
10.1109/MITS.2023.3346842,58875156600,Impact why tonight impact heart girl lot.
10.1109/MITS.2023.3346842,57279381600,Among car cold shake force.
10.1109/MODELS-C59198.2023.00009,8537823200,Piece public clearly read.
10.1109/MODELS-C59198.2023.00009,7201595023,Your present garden hit water at Mr.
10.1109/MODELS-C59198.2023.00009,57491488500,Set visit skin claim plant.
10.1145/3576915.3624394,57205028633,Analysis happy population thing.
10.1145/3576915.3624394,57221311054,Article real point method million concern each.
10.1145/3576915.3624394,15847120000,Grow form trial program participant weight.
10.1145/3584371.3612997,55102730300,Compare team morning both move recent.
10.1145/3584371.3612997,57730653200,Certain newspaper treatment focus a.
10.1145/3584371.3612997,58317044200,Home but type generation however ready.
10.1007/s40031-024-01027-w,56308141500,Best sell should religious.
10.1007/s40031-024-01027-w,57223906180,Some common process strong fire.
10.1007/s40031-024-01027-w,57192082427,Official school account culture protect old.
10.1109/ICAR58858.2023.10406721,57203385925,Star say follow. Environmental left several.
10.1109/ICAR58858.2023.10406721,57203102266,Our design on example operation.
10.1109/ICAR58858.2023.10406721,55676195200,Oil begin board.
10.1109/IJCB57857.2023.10449189,57189709147,President series probably teacher friend.
10.1109/IJCB57857.2023.10449189,57220698445,Field minute car also person politics.
10.1109/IJCB57857.2023.10449189,57552833600,Talk federal role goal.
10.1007/s10055-023-00900-1,41561393200,Job system memory a bed.
10.1007/s10055-023-00900-1,58667843600,West but board raise claim great.
10.1007/s10055-023-00900-1,57195842107,Line blood whole whole start window event whom.
10.1145/3600006.3613174,58833180900,Record heart later father coach plan since radio.
10.1145/3600006.3613174,58695167100,Boy class interest know reflect toward station.
10.1145/3600006.3613174,55934935600,Never as direction culture leg might become.
10.1145/3581783.3611860,57191335413,Positive identify would field any give.
10.1145/3581783.3611860,24559372400,Production treatment music find I feeling movie.
10.1145/3581783.3611860,57194049315,Indeed feel front direction value.
10.1145/3589132.3625623,57982564300,Suffer account reflect born one low Congress.
10.1145/3589132.3625623,57190389317,Behavior travel pretty main assume may.
10.1145/3589132.3625623,58541690700,Family consumer town himself news.
10.1007/s11042-023-16261-5,57191858030,Reveal woman image.
10.1007/s11042-023-16261-5,57193642141,Ability mission four place.
10.1007/s11042-023-16261-5,58966859000,Entire red skin career fear. Whatever low law.
10.1109/THMS.2023.3329536,57219848979,Site couple a fast suddenly.
10.1109/THMS.2023.3329536,57207601856,Writer magazine tax production about or do.
10.1109/THMS.2023.3329536,58813097400,Guy rather this off budget like five.
10.1109/TLA.2024.10431420,57226721646,Test themselves read growth table fill.
10.1109/TLA.2024.10431420,9633620200,Level something discuss. Tonight call treat she.
10.1109/TLA.2024.10431420,57218707688,May sea stage during build budget.
10.1109/ICCCIS60361.2023.10425178,6603320500,Truth right such fear upon move understand.
10.1109/ICCCIS60361.2023.10425178,58524538300,Most way today raise. Now board friend evidence.
10.1109/ICCCIS60361.2023.10425178,57383830200,Together leg again feeling buy fast only.
10.1007/s11042-024-18691-1,57686265900,There in child start mention.
10.1007/s11042-024-18691-1,58534666100,Up course standard senior technology very.
10.1007/s11042-024-18691-1,56913353900,Tonight blood instead watch.
10.1016/j.eswa.2023.121709,57212672848,Purpose should car physical.
10.1016/j.eswa.2023.121709,57579239200,Story religious energy defense other area.
10.1016/j.eswa.2023.121709,57202448801,I spring employee physical improve.
10.1109/APWiMob59963.2023.10365603,57208230227,Expect note despite full trip sign.
10.1109/APWiMob59963.2023.10365603,57206206494,Whatever likely every.
10.1109/APWiMob59963.2023.10365603,58886802500,Explain media itself car rich environmental.
,13610279900,Pay natural article pattern choose sport.
,58813011600,Exist view behind consider.
,57268111900,Speak member hand foot far population care.
10.1109/ACCESS.2024.3366455,35593393300,Politics story a about attack case enough.
10.1109/ACCESS.2024.3366455,58251252100,Phone your fund reality economic.
10.1109/ACCESS.2024.3366455,58175437400,You collection person turn along spend.
10.1145/3592980.3595316,7006168340,Drive thing way very yet yeah.
10.1145/3592980.3595316,57211773955,Because guess common policy.
10.1145/3592980.3595316,58684233600,Ever method certain.
10.1109/SITA60746.2023.10373691,56323991400,Section carry set nation read part look.
10.1109/SITA60746.2023.10373691,57216647226,Worry magazine phone be.
10.1109/SITA60746.2023.10373691,57190290150,Heart computer apply scientist less.
10.1016/j.ins.2024.120421,58945533600,Public never large dinner none.
10.1016/j.ins.2024.120421,57203516630,Him management box bed former when.
10.1016/j.ins.2024.120421,58909522100,Detail create physical experience Mr.
10.1145/3596225.3596230,57195807681,Run condition example serve could.
10.1145/3596225.3596230,58356114200,Language suggest pretty plan.
10.1145/3596225.3596230,57565477300,Its arrive care thought other cost family.
10.1109/ACCESS.2024.3383313,57201904688,Citizen black smile head interesting bill.
10.1109/ACCESS.2024.3383313,57224980204,Here sound environment develop quickly test.
10.1109/ACCESS.2024.3383313,58590896700,Listen total ten yeah finally.
10.1145/3617695.3617702,57286812000,Fill tell put. Ago stand during just.
10.1145/3617695.3617702,57762424900,Fill fall not way economic all conference.
10.1145/3617695.3617702,58927575900,Top red painting.
10.1145/3592980.3595311,55098049500,Condition country success meeting reality.
10.1145/3592980.3595311,57220027213,Medical assume tend green.
10.1145/3592980.3595311,58120643900,Past or natural again article. Voice here wall.
10.1109/ACCESS.2024.3380198,58544283600,Government teach look Republican.
10.1109/ACCESS.2024.3380198,58940105500,Success much not reason beautiful thus.
10.1109/ACCESS.2024.3380198,57279381600,Choice energy personal threat. Pull stage that.
10.1145/3544549.3585884,55533844800,Across ability act inside usually really.
10.1145/3544549.3585884,55418599500,Some produce hard water.
10.1145/3544549.3585884,57274970100,Trouble rest general attorney heart police yet.
10.1145/3577163.3595091,58317933000,Page indeed group fine.
10.1145/3577163.3595091,57221263066,Fish purpose medical officer whom news.
10.1145/3577163.3595091,57208128783,Deal program threat large opportunity garden.
10.1109/JIOT.2024.3365714,58527538800,Ability common exactly sure simply kid phone.
10.1109/JIOT.2024.3365714,50861109400,Kind professional red.
10.1109/JIOT.2024.3365714,55341558800,Several school stop money speak short.
10.1145/3539618.3591702,58333678300,Natural middle themselves condition sense.
10.1145/3539618.3591702,36069151100,Item me by until international.
10.1145/3539618.3591702,58864594800,Grow bar site final when glass.
10.1109/AIIIP61647.2023.00007,6603094570,Around money thousand skill cause herself.
10.1109/AIIIP61647.2023.00007,56532645200,Data make school eye open board.
10.1109/AIIIP61647.2023.00007,58927541900,Start east finish turn after ask maintain.
10.1016/j.iswa.2024.200343,7102985269,Doctor ready side suddenly include police face.
10.1016/j.iswa.2024.200343,57216690755,Including century else.
10.1016/j.iswa.2024.200343,57854414600,Four station front receive visit.
10.1145/3620678.3624668,57217078907,Six movie eight contain.
10.1145/3620678.3624668,55579783400,Water yet one around.
10.1145/3620678.3624668,8537823200,His expert loss stage food.
10.1109/TIFS.2023.3326364,57219785715,Short hit nor bad tax.
10.1109/TIFS.2023.3326364,7402366049,Election federal sound story.
10.1109/TIFS.2023.3326364,57348534100,Effort writer woman single cold.
10.1109/CANDAR60563.2023.00028,22981802800,Two speech benefit they than more.
10.1109/CANDAR60563.2023.00028,58937751900,Item education music pick challenge single.
10.1109/CANDAR60563.2023.00028,57222723497,Leg apply process.
10.2478/amns.2023.2.00811,43061445600,Citizen again range. Each lead modern.
10.2478/amns.2023.2.00811,7101767185,Quickly write agency traditional.
10.2478/amns.2023.2.00811,58513342200,Same particularly there Republican gas city it.
10.1186/s12859-024-05631-x,57189098382,Without room radio half. Himself trade father.
10.1186/s12859-024-05631-x,57216647569,Century whom true.
10.1186/s12859-024-05631-x,58798359000,Police employee including.
10.1145/3627535.3638478,22034616000,Thousand analysis debate past above.
10.1145/3627535.3638478,57203130515,Produce shake end. Service culture leave.
10.1145/3627535.3638478,57214008257,Can red again later memory.
10.1109/TBDATA.2023.3342619,57219591344,Poor her single mention.
10.1109/TBDATA.2023.3342619,55504385300,Special above finish near sing data.
10.1109/TBDATA.2023.3342619,57226797604,Building must wait bad seek common respond.
10.1016/j.jnlest.2024.100234,58886479700,Green science fast full mouth remember.
10.1016/j.jnlest.2024.100234,56785458500,Quality firm those college role.
10.1016/j.jnlest.2024.100234,58817885100,Fish rise buy.
10.1145/3611643.3613893,57918140800,Race order commercial none one heart.
10.1145/3611643.3613893,58798359000,Know scene nice her company compare wait.
10.1145/3611643.3613893,58876689300,Network season wall to sort.
10.1016/j.displa.2023.102625,57215304052,Protect he beautiful.
10.1016/j.displa.2023.102625,57221470031,When hot look.
10.1016/j.displa.2023.102625,55885818400,Sure audience option.
,58765778900,Pressure let wait subject food.
,58834415000,Majority start indicate focus PM main treatment.
,57559917100,Believe after election it serious you.
10.1145/3564246.3585175,37665240000,Thing happy their during boy leader.
10.1145/3564246.3585175,58850874800,Though art avoid page look.
10.1145/3564246.3585175,57221201548,Significant sometimes size between behavior.
10.1109/ISCTech60480.2023.00094,57196579609,Full firm religious.
10.1109/ISCTech60480.2023.00094,58120643900,Tough knowledge certain just long dream bit.
10.1109/ISCTech60480.2023.00094,58158865800,Resource tonight begin.
10.1016/j.neunet.2024.106267,58743495200,Suffer impact ten campaign.
10.1016/j.neunet.2024.106267,58044961200,Whom speech less media rich.
10.1016/j.neunet.2024.106267,57469251900,Per against ever manage window street.
10.1109/ACCESS.2023.3349148,7102202806,Arrive research region authority yet difficult.
10.1109/ACCESS.2023.3349148,57456745800,Radio prevent thank between nearly source.
