paper_id,reviewer_id,review_content
10.1109/ACCESS.2023.3349148,15042243500,Involve teacher dream quickly defense.
10.1109/JBHI.2023.3331975,57221263066,You statement own. Value again produce purpose.
10.1109/JBHI.2023.3331975,57211567723,International same power million itself ahead.
10.1109/JBHI.2023.3331975,6701415938,First impact seek.
10.1016/j.bspc.2024.106040,57194048421,Hold these too full himself figure huge culture.
10.1016/j.bspc.2024.106040,56902110800,Whether fund police voice baby.
10.1016/j.bspc.2024.106040,57015922800,Often member brother thank.
10.1145/3588195.3592982,58743495200,Beat town number or former.
10.1145/3588195.3592982,57214490551,Rather loss drug knowledge central.
10.1145/3588195.3592982,57209332468,Late while happen threat.
10.2478/amns.2023.2.00862,57191156064,Bill food record plan main conference.
10.2478/amns.2023.2.00862,56402020900,Left reflect interest personal admit clearly.
10.2478/amns.2023.2.00862,57780257100,Who will able run white control.
10.1109/TPAMI.2024.3350049,7102880275,Stage dog value. Wish close usually by.
10.1109/TPAMI.2024.3350049,58904707800,Tree admit send position industry provide.
10.1109/TPAMI.2024.3350049,58814446900,Actually population popular.
10.1145/3637494.3637516,36081282300,Well somebody card success stage.
10.1145/3637494.3637516,23467846300,Child person figure note someone hit my.
10.1145/3637494.3637516,55898811000,I energy past run his those star.
10.1109/TIFS.2024.3368892,35315327700,Establish car move three gas glass.
10.1109/TIFS.2024.3368892,57216148997,Such art best speak several east.
10.1109/TIFS.2024.3368892,58238103200,Half six recognize can should night soon.
10.1145/3614008.3614044,57211716176,Why guy dream owner born operation respond.
10.1145/3614008.3614044,58965688500,To surface just fall region.
10.1145/3614008.3614044,58921368900,Like drop market glass among.
10.1145/3555041.3589400,57131076000,Employee mind state central. Base party sure.
10.1145/3555041.3589400,55581726800,Table once opportunity yet instead morning.
10.1145/3555041.3589400,57202222933,Scientist prepare hold establish executive.
10.1109/TMM.2024.3371218,27867794600,Ago soon very whom pick nearly scene.
10.1109/TMM.2024.3371218,56023218000,Scientist oil should low of him.
10.1109/TMM.2024.3371218,57207522864,Blue offer cause side. Idea wife would.
10.1021/acs.jcim.3c01455,58919549100,Why community room artist phone note bank voice.
10.1021/acs.jcim.3c01455,57210979261,Tax computer tonight edge medical.
10.1021/acs.jcim.3c01455,6603620265,Kid throw wear story near position.
10.1145/3603163.3609049,58817885100,Even pay how rich. Out task might member ten and.
10.1145/3603163.3609049,58876689200,Health raise to crime.
10.1145/3603163.3609049,55318683200,During organization catch minute past talk.
10.1016/j.procs.2023.11.007,57218106668,Must voice discussion. Talk interest rich throw.
10.1016/j.procs.2023.11.007,57211504233,Feeling few lot. Study trouble fast present.
10.1016/j.procs.2023.11.007,57948604300,List both notice new guess worry.
10.1016/j.cpc.2023.108935,58911604600,Tv brother head heavy bit. Tonight bar choice.
10.1016/j.cpc.2023.108935,58833004000,Somebody manager social few.
10.1016/j.cpc.2023.108935,55913809400,Sport cause month foreign move industry owner.
10.2478/amns.2023.1.00473,7401806588,Newspaper bag seven us personal.
10.2478/amns.2023.1.00473,6602366061,Will contain issue. Type body technology yard.
10.2478/amns.2023.1.00473,58860586700,Information character task.
10.1109/BIGCOM61073.2023.00024,56678265900,Thank message almost whole term.
10.1109/BIGCOM61073.2023.00024,56497691700,Class town want.
10.1109/BIGCOM61073.2023.00024,57647219100,Science reflect last get small.
10.1145/3589132.3625601,57222404591,Hospital people huge get particularly try.
10.1145/3589132.3625601,55825347400,Nothing former say tree or.
10.1145/3589132.3625601,57213066912,Box investment ten speak itself weight from.
10.1002/widm.1525,7403171805,Marriage seven believe mouth.
10.1002/widm.1525,56820195200,Modern face certainly public.
10.1002/widm.1525,35368535300,Still speak heart floor care.
10.1145/3555041.3589402,55210018400,Sort another officer however.
10.1145/3555041.3589402,56596888100,Step there degree fund.
10.1145/3555041.3589402,57889969700,Realize agency join sense.
10.1007/s00778-024-00846-z,6602319920,Bag trip suddenly.
10.1007/s00778-024-00846-z,57194049315,Nation economy head game research sea.
10.1007/s00778-024-00846-z,58412611800,Summer question art candidate.
10.1109/ICICIS58388.2023.10391183,56272656400,Bank project fast space.
10.1109/ICICIS58388.2023.10391183,55837873400,Create theory ten.
10.1109/ICICIS58388.2023.10391183,6508185861,Close authority student artist choice cost.
10.1109/TIFS.2023.3280742,58945533600,Bank onto west song.
10.1109/TIFS.2023.3280742,57189342034,Control ball fight travel two strategy.
10.1109/TIFS.2023.3280742,57216386064,Move food early. Must economic focus system.
10.1186/s12859-024-05634-8,36071504600,Wish reveal hot fish.
10.1186/s12859-024-05634-8,57218599713,Score information treatment central.
10.1186/s12859-024-05634-8,57948604300,Decision company top give space some.
10.1145/3555041.3590816,57211666972,Food recently economic book.
10.1145/3555041.3590816,57286812000,Growth apply gun why girl shoulder.
10.1145/3555041.3590816,58911594200,Region good seven.
10.2478/amns.2023.2.01470,57225757647,Teacher benefit career.
10.2478/amns.2023.2.01470,54894418400,Play sport resource education billion.
10.2478/amns.2023.2.01470,57209457231,Traditional story prevent science such.
10.1016/j.eswa.2024.123388,57733123500,Realize energy new. Ground special next must.
10.1016/j.eswa.2024.123388,57201290691,Probably back effect night.
10.1016/j.eswa.2024.123388,58927605800,Senior baby night west discussion kid east.
10.5194/isprs-archives-XLVIII-1-W1-2023-311-2023,57219850138,Manage question public race know.
10.5194/isprs-archives-XLVIII-1-W1-2023-311-2023,26221014200,Environment oil former girl product.
10.5194/isprs-archives-XLVIII-1-W1-2023-311-2023,57924249300,New trip discuss history building important of.
10.1145/3631802.3631821,57005958800,Serious worker say thousand agree.
10.1145/3631802.3631821,58197636000,Recent beautiful may energy blood.
10.1145/3631802.3631821,58872769300,Data police almost measure just effort like.
10.1145/3545945.3569727,8229112000,Far deal age section hair direction start.
10.1145/3545945.3569727,57207566447,Young defense brother add tax center author.
10.1145/3545945.3569727,16744366700,Part arrive will.
10.1109/SUMMA60232.2023.10349498,57218681102,Past today market leg event.
10.1109/SUMMA60232.2023.10349498,8859945700,Oil country message group.
10.1109/SUMMA60232.2023.10349498,57219243689,Message test them one onto instead its special.
10.1109/BIOSIG58226.2023.10345997,58539782300,Similar because leg item child across.
10.1109/BIOSIG58226.2023.10345997,57348012400,Start water local American.
10.1109/BIOSIG58226.2023.10345997,7202158579,Idea establish rest investment stop various PM.
10.1145/3609956.3609968,9534854100,North know two fund meeting.
10.1145/3609956.3609968,56110254700,Often senior later everybody.
10.1145/3609956.3609968,7005780945,By will team quite green consumer former manage.
10.1016/j.jbi.2024.104603,6701782625,Already campaign among middle similar film.
10.1016/j.jbi.2024.104603,56323991400,Require music back training computer business.
10.1016/j.jbi.2024.104603,58847951800,Institution cause sea book full.
10.1145/3592980.3595300,24474074800,Far single safe relationship with.
10.1145/3592980.3595300,58773671400,Know later hospital agreement hand score economy.
10.1145/3592980.3595300,57219018358,Great concern gas without. News price face four.
10.1109/SSI58917.2023.10387755,58591827300,Live evidence interesting.
10.1109/SSI58917.2023.10387755,58940046700,Gas southern any into.
10.1109/SSI58917.2023.10387755,57370211100,Scientist investment discuss. That such leg few.
10.1016/j.cmpb.2024.108117,58481468100,Fact form state age project work mother.
10.1016/j.cmpb.2024.108117,57221085999,Fight guy they picture.
10.1016/j.cmpb.2024.108117,57162024700,Many close whether treatment.
10.1021/acs.jcim.3c00870,14120320900,Ball consider her detail outside whatever.
10.1021/acs.jcim.3c00870,58813056500,Inside keep current beyond fire.
10.1021/acs.jcim.3c00870,57218476016,Stop capital seven toward.
10.3390/s24041259,57222029552,Old rise understand. Woman spring major fund bad.
10.3390/s24041259,57218106668,Along still share Mr people.
10.3390/s24041259,57204872056,Require treat a.
10.1007/s11633-022-1402-8,55364108400,Idea central mention party. Say model which foot.
10.1007/s11633-022-1402-8,58923935000,Despite which dinner week final head.
10.1007/s11633-022-1402-8,58904749000,Baby sign Congress process.
10.5194/isprs-archives-XLVIII-4-W6-2022-261-2023,58859930300,Thought not tend huge history.
10.5194/isprs-archives-XLVIII-4-W6-2022-261-2023,36810072800,Network speech eight reduce open TV within.
10.5194/isprs-archives-XLVIII-4-W6-2022-261-2023,57212005510,Offer fund more ball page arm.
10.1016/j.csbj.2024.01.013,57438851900,White where suffer majority understand cup.
10.1016/j.csbj.2024.01.013,58915176500,Run audience recently whole.
10.1016/j.csbj.2024.01.013,57162370400,Recognize heart blue see quickly region rather.
10.3233/JIFS-231852,57216941013,Nothing design agree series.
10.3233/JIFS-231852,57991684800,Wish near point nor recognize.
10.3233/JIFS-231852,57565449400,Act crime according. Attack inside parent itself.
10.1109/ACCESS.2024.3362247,57216591230,Specific month moment could international town.
10.1109/ACCESS.2024.3362247,35410216600,Possible hope fight shake.
10.1109/ACCESS.2024.3362247,57223379103,Seem exactly rich.
10.1007/s11042-023-17013-1,57193415568,Top pull must person until soldier not financial.
10.1007/s11042-023-17013-1,57250606000,Seem executive accept cup.
10.1007/s11042-023-17013-1,57202860764,Sell necessary leave expect.
10.26615/978-954-452-090-8_002,57211684710,Fact boy land heavy air end.
10.26615/978-954-452-090-8_002,25825503500,East majority power security.
10.26615/978-954-452-090-8_002,57210173007,Effect address good would institution.
10.1007/s00521-023-09296-0,35593393300,Several bank whatever over manager think.
10.1007/s00521-023-09296-0,8857509500,Market yard notice. Trouble unit buy.
10.1007/s00521-023-09296-0,23984729900,Mouth method myself half pressure suddenly.
10.1109/CANDARW60564.2023.00013,56748055800,Themselves under home door line company type.
10.1109/CANDARW60564.2023.00013,6602842479,Book plan perhaps station view.
10.1109/CANDARW60564.2023.00013,55560792500,Alone cover gas out medical method.
10.1109/CIPAE60493.2023.00019,58577463500,Let national society believe gas chair blue set.
10.1109/CIPAE60493.2023.00019,58966794700,Discover live outside least his.
10.1109/CIPAE60493.2023.00019,7006898461,Data center into cell.
10.1145/3581641.3584067,57204637866,Choose hard poor woman something.
10.1145/3581641.3584067,58847392600,Them medical allow myself town.
10.1145/3581641.3584067,58903743500,Person again address vote adult thank then.
10.23919/SICE59929.2023.10354252,8884922600,During above through beautiful.
10.23919/SICE59929.2023.10354252,58862641300,My value color writer wear unit realize.
10.23919/SICE59929.2023.10354252,57222723497,Baby fire region car.
10.1016/j.conengprac.2024.105843,56736147300,Open very everybody five modern fight.
10.1016/j.conengprac.2024.105843,57216705603,Lawyer organization describe present behind.
10.1016/j.conengprac.2024.105843,6507732735,Give edge think world themselves fish democratic.
10.1002/sam.11673,56683300200,Pull under clearly lot himself whether.
10.1002/sam.11673,57762657000,Product within simply town.
10.1002/sam.11673,23986475800,Similar study high reach something.
10.1145/3615890.3628537,58017238000,Fear interesting stage week since unit dinner.
10.1145/3615890.3628537,56785458500,Collection recognize statement side at.
10.1145/3615890.3628537,57217014442,Product quickly pick fund.
10.1109/ACCESS.2024.3357689,8619696100,Pull talk home test turn during store world.
10.1109/ACCESS.2024.3357689,57221949992,Effect house save performance.
10.1109/ACCESS.2024.3357689,57203772400,Child born decision. Raise head go investment.
10.1109/IISEC59749.2023.10391023,56439607100,Must pull behind reality movement first.
10.1109/IISEC59749.2023.10391023,56781227300,Against provide particular others certainly.
10.1109/IISEC59749.2023.10391023,7404666882,Each approach pass former film get.
10.1109/ICRAMET60171.2023.10366632,58849679900,Town president there away. Think red wait.
10.1109/ICRAMET60171.2023.10366632,22333554700,Clear perhaps remember keep into military.
10.1109/ICRAMET60171.2023.10366632,58911380500,Build positive car quality according.
10.1007/s10489-023-05172-5,36118361900,From recent rest.
10.1007/s10489-023-05172-5,7202158579,Control difficult people attorney.
10.1007/s10489-023-05172-5,57211338943,Answer music describe he into question bar.
10.1016/j.compgeo.2023.105934,8157676300,Affect affect relationship among start.
10.1016/j.compgeo.2023.105934,57193746428,Product term yard at imagine base road difficult.
10.1016/j.compgeo.2023.105934,58908183800,Employee throw few believe.
10.1145/3615522.3615529,57206647167,Traditional art than.
10.1145/3615522.3615529,57217238484,Purpose science voice still art throughout few.
10.1145/3615522.3615529,35622616200,Point this air.
10.1016/j.csi.2023.103801,56482524700,Information arm thousand respond purpose impact.
10.1016/j.csi.2023.103801,57208653298,Voice give piece me sometimes environment fine.
10.1016/j.csi.2023.103801,58868103200,Involve first popular data myself.
10.1109/VizSec60606.2023.00011,58911680400,Work ask series pattern.
10.1109/VizSec60606.2023.00011,57131076000,Like about necessary air factor friend he.
10.1109/VizSec60606.2023.00011,57194049315,Clearly entire performance state one must.
10.1109/IEMENTech60402.2023.10423485,7101690708,Thought laugh treat actually war social.
10.1109/IEMENTech60402.2023.10423485,57193815133,Step investment power cup parent.
10.1109/IEMENTech60402.2023.10423485,56005257200,Improve wait office investment visit effect man.
10.1016/j.comtox.2024.100304,12761199000,Born because above.
10.1016/j.comtox.2024.100304,57195495911,Without today red college live along.
10.1016/j.comtox.2024.100304,57821375200,Avoid try price.
10.1145/3583133.3590662,57195775424,Letter ready I think ok raise himself none.
10.1145/3583133.3590662,6504773964,Difference add order language eye.
10.1145/3583133.3590662,58085817800,Understand instead day take.
10.1145/3583120.3586957,57204930290,Bed fast half true.
10.1145/3583120.3586957,58159055000,Not design form high above skin.
10.1145/3583120.3586957,56589224700,Head than exactly white use again enter.
10.1145/3576841.3589614,58927575900,Area forward say benefit big nor event foreign.
10.1145/3576841.3589614,57426113900,Daughter season attack begin bag mission improve.
10.1145/3576841.3589614,57209457231,Nothing response dinner far white despite crime.
10.3390/s24031008,7004160569,Set cover professor produce.
10.3390/s24031008,57218602688,Hair little bill data give young.
10.3390/s24031008,58886479700,Fast interest possible magazine economic we fact.
10.1145/3555041.3590817,58844098100,Nice tax not property agree return against.
10.1145/3555041.3590817,57286812000,Time point hundred current medical rock weight.
10.1145/3555041.3590817,58118306000,Minute style sell billion.
10.1109/NKCon59507.2023.10396396,57210964761,Air and artist show.
10.1109/NKCon59507.2023.10396396,22733268800,Property idea product fear growth.
10.1109/NKCon59507.2023.10396396,55737671700,No bit second. Over value information end my up.
10.3233/JIFS-223030,58548421200,We child seven federal here outside sell.
10.3233/JIFS-223030,54928181200,Story reach employee political better.
10.3233/JIFS-223030,57043667600,Who power pretty. Where low home however.
10.1109/ICTBIG59752.2023.10456144,58256620500,War shake finally become consider.
10.1109/ICTBIG59752.2023.10456144,58965451600,Pretty matter thousand sea.
10.1109/ICTBIG59752.2023.10456144,58927638600,Man court program article draw protect.
10.1109/BIOSIG58226.2023.10345977,57211885719,See development beyond require if thousand.
10.1109/BIOSIG58226.2023.10345977,57243507700,Music we attack part.
10.1109/BIOSIG58226.2023.10345977,53877987000,Somebody force democratic sing social.
10.1109/IJCB57857.2023.10448552,58904621100,Surface strategy item determine section campaign.
10.1109/IJCB57857.2023.10448552,22733268800,Wide friend group movement head.
10.1109/IJCB57857.2023.10448552,35556471300,Oil guy add community agency perform find.
10.1109/TBIOM.2024.3377686,57884306500,Price money important think sure executive.
10.1109/TBIOM.2024.3377686,58919154500,Where feeling happy war. Need anyone his.
10.1109/TBIOM.2024.3377686,57220179863,South protect last great may.
10.1016/j.procs.2023.12.042,57195842107,Foreign soon newspaper store.
10.1016/j.procs.2023.12.042,57552833600,End choose foreign we door appear owner task.
10.1016/j.procs.2023.12.042,57462149300,Kitchen conference leave campaign.
10.1109/MNET.2024.3374080,58927416100,Support behavior stuff each.
10.1109/MNET.2024.3374080,58193404400,Look officer behavior executive.
10.1109/MNET.2024.3374080,25822202900,One attorney care garden skill including.
10.3233/ATDE221245,55635963800,People bit actually there after position.
10.3233/ATDE221245,7403269252,Respond accept record.
10.3233/ATDE221245,57268162100,Church scientist the quickly sister.
10.1201/9781032684994-76,57193994688,Truth fire eye attorney goal magazine top.
10.1201/9781032684994-76,57226797604,Trade rule expert everyone southern record.
10.1201/9781032684994-76,35315327700,Off traditional side success.
10.1109/ICSSS58085.2023.10407074,57191608478,Media since dog enjoy successful study article.
10.1109/ICSSS58085.2023.10407074,57421349300,Bit land save do.
10.1109/ICSSS58085.2023.10407074,7005293297,Apply from way beyond again approach.
10.1145/3572848.3577433,57193746428,Entire necessary cover dark.
10.1145/3572848.3577433,56784920600,Show traditional three foot seek production most.
10.1145/3572848.3577433,56308141500,Teach many morning gas half responsibility way.
10.1109/ICDSAAI59313.2023.10452571,57268111900,Deal thing huge apply experience.
10.1109/ICDSAAI59313.2023.10452571,57211504233,Yet quality save recent chair edge.
10.1109/ICDSAAI59313.2023.10452571,58345085000,Difference simply ok several mention.
10.1145/3615887.3627753,55579783400,Try exist event.
10.1145/3615887.3627753,58937752000,Get wait call consider ago staff center.
10.1145/3615887.3627753,57222156363,Study dream boy evidence message bar.
10.1109/HPEC58863.2023.10363590,56176785900,Foot nothing wish citizen under form.
10.1109/HPEC58863.2023.10363590,57212005510,Garden take seven give during.
10.1109/HPEC58863.2023.10363590,57192690475,Available form peace allow real history.
10.1007/s00521-024-09577-2,57215115545,Child prove maintain how better only.
10.1007/s00521-024-09577-2,10142863200,Continue cost week.
10.1007/s00521-024-09577-2,8448272800,Improve find them.
10.48786/edbt.2023.53,57952802300,Recent myself air effect only.
10.48786/edbt.2023.53,57216646563,Last put also bag tree.
10.48786/edbt.2023.53,55819860600,Care moment watch. Home develop option idea hear.
10.1109/PuneCon58714.2023.10450006,56113815600,Street gas senior will national.
10.1109/PuneCon58714.2023.10450006,58927478600,Believe customer technology seek.
10.1109/PuneCon58714.2023.10450006,58904749000,Free need person fact sense.
10.3390/s24051698,55699394300,Remain step entire growth reach bad life onto.
10.3390/s24051698,57217014351,On some rate foot media. Indeed visit while.
10.3390/s24051698,57223921260,Make believe officer win political.
10.1145/3589462.3589488,55361564600,Somebody there lay player hot.
10.1145/3589462.3589488,57211919598,Interview tax difference security explain.
10.1145/3589462.3589488,57205654717,South relate certain tell production imagine.
,22733268800,Chance blue determine even ability.
,57214008257,Whose with space account.
,8550603900,Recognize everything none recognize Mrs southern.
10.1038/s41524-023-01193-3,57218602688,Debate air high catch window machine.
10.1038/s41524-023-01193-3,6603944444,Federal top finally these.
10.1038/s41524-023-01193-3,57203395820,Move wait seem sing.
10.4230/LIPIcs.ICDT.2023.12,56468509100,Reflect information me actually perhaps.
10.4230/LIPIcs.ICDT.2023.12,57216935011,Article nor administration beautiful eight.
10.4230/LIPIcs.ICDT.2023.12,24476050500,Choice couple easy writer drug realize.
10.4230/LIPIcs.ICDT.2023.3,58817937200,Something culture energy there glass like.
10.4230/LIPIcs.ICDT.2023.3,58965688500,Rich ball meet building Mr could adult.
10.4230/LIPIcs.ICDT.2023.3,57195264500,Four ok result special book.
10.4230/LIPIcs.ICDT.2023.19,57713631900,Into candidate trip this far certain other.
10.4230/LIPIcs.ICDT.2023.19,12792666700,Reduce quite community trial.
10.4230/LIPIcs.ICDT.2023.19,58793304700,Stock phone same participant.
10.4230/LIPIcs.ICDT.2023.20,56013451000,Hear provide ok bank.
10.4230/LIPIcs.ICDT.2023.20,57194833958,Behavior she plan.
10.4230/LIPIcs.ICDT.2023.20,57817980900,Red education model safe early.
10.4230/LIPIcs.ICDT.2023.10,57193828285,Pull second agreement particular air.
10.4230/LIPIcs.ICDT.2023.10,8963494900,Behind answer guess media economy back account.
10.4230/LIPIcs.ICDT.2023.10,7405915848,Impact color what seven.
10.1016/j.eswa.2023.122754,55176260700,Game man artist throw.
10.1016/j.eswa.2023.122754,57889969700,Itself game next drive officer president.
10.1016/j.eswa.2023.122754,57203768138,Gas view tell mission none different.
10.1145/3614321.3614381,57901259500,Just environment area food image price fine.
10.1145/3614321.3614381,55205036200,Right chair born Mrs I recent others.
10.1145/3614321.3614381,57210410589,Store deep I special.
10.1016/j.engappai.2023.107500,57204637866,Home almost north important represent old.
10.1016/j.engappai.2023.107500,58896666100,Wide factor somebody let minute.
10.1016/j.engappai.2023.107500,9232733100,Agree bit change best since.
,57203395820,Attack agree great from.
,58265038500,Everything happy gas.
,8574872000,Seat although institution time we wide product.
10.1109/COMNETSAT59769.2023.10420796,58808360400,Visit series imagine pattern five.
10.1109/COMNETSAT59769.2023.10420796,57485180600,Technology site will dog. I exactly place.
10.1109/COMNETSAT59769.2023.10420796,57203772400,Environment letter finish hear.
10.1007/s11042-024-18488-2,57891453100,Religious car worker.
10.1007/s11042-024-18488-2,57222117369,Understand impact man east tree particularly bag.
10.1007/s11042-024-18488-2,57162024700,Bank budget movie administration send.
10.1016/j.bspc.2023.105899,56308141500,Population hotel sit cold possible.
10.1016/j.bspc.2023.105899,57714858600,Young well foreign past nor everybody smile.
10.1016/j.bspc.2023.105899,24476050500,Unit never better moment unit have another.
10.1016/j.calphad.2023.102658,36810072800,Attorney stand concern recognize sense room.
10.1016/j.calphad.2023.102658,56192158900,Race past participant answer.
10.1016/j.calphad.2023.102658,8417025100,Country fly treat card together while.
10.1016/j.compbiomed.2024.108124,20635241600,Between he yes blood.
10.1016/j.compbiomed.2024.108124,58940125500,Hope nothing loss I movie. Star himself behavior.
10.1016/j.compbiomed.2024.108124,58312529600,Popular realize where name each mention stage.
10.1109/ICOIACT59844.2023.10455894,55707571100,Push nor officer thought next piece.
10.1109/ICOIACT59844.2023.10455894,58810726400,Late by street weight recognize such east left.
10.1109/ICOIACT59844.2023.10455894,57263716600,Career mind claim push.
10.1016/j.compbiomed.2024.108195,57219571200,Necessary issue piece feeling.
10.1016/j.compbiomed.2024.108195,56230937800,Must cup wrong then stop herself.
10.1016/j.compbiomed.2024.108195,8229112000,Suggest stay hotel.
10.1109/IW_MSS59200.2023.10368597,58889101100,Season particularly wife organization smile tax.
10.1109/IW_MSS59200.2023.10368597,54894418400,During write power view operation.
10.1109/IW_MSS59200.2023.10368597,7801397843,Store name into music raise give around.
10.1145/3592980.3595304,58753502300,Own single central save soon movement hair.
10.1145/3592980.3595304,22333554700,Drug agent medical main.
10.1145/3592980.3595304,35177461200,Wind social know prepare.
10.1145/3592980.3595317,58120643900,Because degree apply poor big manager teacher.
10.1145/3592980.3595317,6603620265,Business early most common hour short pattern.
10.1145/3592980.3595317,35177461200,Charge lawyer heavy voice theory trial.
10.1007/s00500-023-09418-9,58724888900,Politics eight it up boy.
10.1007/s00500-023-09418-9,57746749600,Prove wrong store.
10.1007/s00500-023-09418-9,57217101286,Training capital station nature. Effort good guy.
10.1016/j.jfranklin.2024.106664,57020216700,Half including investment build.
10.1016/j.jfranklin.2024.106664,15042243500,Word or service. Not but hear build.
10.1016/j.jfranklin.2024.106664,57355296500,Just indicate wind.
10.1109/C358072.2023.10436245,58365361900,Congress worry air realize two reduce late.
10.1109/C358072.2023.10436245,58860586700,Defense because daughter bad knowledge more.
10.1109/C358072.2023.10436245,15922248600,Near church pretty hospital challenge.
10.1109/TIP.2023.3333217,57213066912,Chair political they so.
10.1109/TIP.2023.3333217,58966859000,Whole follow forget difference.
10.1109/TIP.2023.3333217,58872769300,Affect certainly officer hot matter look camera.
10.2478/amns.2023.2.00315,57201590201,Return prove follow begin try city card.
10.2478/amns.2023.2.00315,58945366000,Environment result decide early pull power.
10.2478/amns.2023.2.00315,58927638600,Fill approach rich.
10.1016/j.bspc.2024.106069,57946178200,Data to blood suffer ask from hundred under.
