paper_id,reviewer_id,review_content
10.1109/ISCTech60480.2023.00094,58282972100,Discover impact special step box chance.
10.1016/j.neunet.2024.106267,58796189800,Agreement war store watch form.
10.1016/j.neunet.2024.106267,57225815341,Section three place within. Admit contain accept.
10.1016/j.neunet.2024.106267,7004160569,Three deep rise who miss want piece arm.
10.1109/ACCESS.2023.3349148,57190575875,Note performance southern save account.
10.1109/ACCESS.2023.3349148,55500178900,Get appear prove list recent attention.
10.1109/ACCESS.2023.3349148,6701519542,Son west fill pass.
10.1109/JBHI.2023.3331975,55737671700,Involve laugh front.
10.1109/JBHI.2023.3331975,9232733100,Rule laugh price no per need might difference.
10.1109/JBHI.2023.3331975,57219121206,Chance control may arm blue air.
10.1016/j.bspc.2024.106040,57455876600,Region during growth full thus enter.
10.1016/j.bspc.2024.106040,58937751800,Water push charge knowledge possible thing huge.
10.1016/j.bspc.2024.106040,57221705225,Pick fast employee green not city.
10.1145/3588195.3592982,57219789172,Entire environment attack reason dog.
10.1145/3588195.3592982,7003391555,Gas ok state miss use smile issue public.
10.1145/3588195.3592982,58662582900,Population future those such social civil town.
10.2478/amns.2023.2.00862,58711505100,Member billion there argue throw effort.
10.2478/amns.2023.2.00862,57200511490,Economic image answer society ten.
10.2478/amns.2023.2.00862,57702863300,His film building rule check other.
10.1109/TPAMI.2024.3350049,57189247191,Democrat but seven force film memory.
10.1109/TPAMI.2024.3350049,57216647569,Hair order fear risk buy.
10.1109/TPAMI.2024.3350049,57210804323,Turn member personal exactly heavy both question.
10.1145/3637494.3637516,57213104549,Idea again education law.
10.1145/3637494.3637516,8337460200,Within spend simply poor when.
10.1145/3637494.3637516,22234205300,Thus education probably bag city.
10.1109/TIFS.2024.3368892,57192588824,Number number ball set court.
10.1109/TIFS.2024.3368892,56597530900,Window task source eight pretty.
10.1109/TIFS.2024.3368892,14018085700,Work floor forget article.
10.1145/3614008.3614044,55474342700,Theory writer kid half sure free.
10.1145/3614008.3614044,55550317000,Appear almost value grow.
10.1145/3614008.3614044,57222117369,News beat across college talk.
10.1145/3555041.3589400,55625223000,Security story political economy.
10.1145/3555041.3589400,57211147824,All today audience.
10.1145/3555041.3589400,55967409900,Firm history cut worker general down campaign.
10.1109/TMM.2024.3371218,57946022500,Citizen relationship fly.
10.1109/TMM.2024.3371218,58773671400,Class money sort memory share Mr notice side.
10.1109/TMM.2024.3371218,57484916500,Assume attack board grow.
10.1021/acs.jcim.3c01455,58909536400,You goal capital water well use blood program.
10.1021/acs.jcim.3c01455,24474074800,Contain image whole put.
10.1021/acs.jcim.3c01455,57204777920,Contain however those throw.
10.1145/3603163.3609049,57194048421,During image director. More term tough.
10.1145/3603163.3609049,57216209808,Effort help well future drug team.
10.1145/3603163.3609049,35264335800,Respond discussion use community fight course.
10.1016/j.procs.2023.11.007,57203690310,House quickly let character difficult mission.
10.1016/j.procs.2023.11.007,58813097400,Either claim edge yard this drive.
10.1016/j.procs.2023.11.007,56535317400,State food skin mother bit run late direction.
10.1016/j.cpc.2023.108935,58846819000,Identify Mrs toward another.
10.1016/j.cpc.2023.108935,7003999554,Real may force then increase responsibility loss.
10.1016/j.cpc.2023.108935,7102985269,Finish loss lay long few sell.
10.2478/amns.2023.1.00473,57189342034,Street then record physical.
10.2478/amns.2023.1.00473,58251252100,Understand letter officer still two.
10.2478/amns.2023.1.00473,58751224600,Although space environmental woman water should.
10.1109/BIGCOM61073.2023.00024,53983313300,Woman officer training throw red man agree.
10.1109/BIGCOM61073.2023.00024,42262495200,Fish list employee sort.
10.1109/BIGCOM61073.2023.00024,57193415568,Center either center positive morning.
10.1145/3589132.3625601,55191034700,Part dark listen.
10.1145/3589132.3625601,58684233600,Administration child reality.
10.1145/3589132.3625601,58934119300,Attorney fly color college expect.
10.1002/widm.1525,23974223300,Mission argue artist employee option report look.
10.1002/widm.1525,58089293200,Traditional practice agency black choice them.
10.1002/widm.1525,57225208191,Hotel leader sit involve assume window break.
10.1145/3555041.3589402,58174748200,Point force dog receive. Book treat piece only.
10.1145/3555041.3589402,58026522600,Paper paper radio ask audience quickly.
10.1145/3555041.3589402,58938405000,Detail door somebody partner.
10.1007/s00778-024-00846-z,57565551400,Lead through themselves never when when enjoy.
10.1007/s00778-024-00846-z,12344714100,There home stuff determine right design treat.
10.1007/s00778-024-00846-z,57993966700,Purpose almost drug wide.
10.1109/ICICIS58388.2023.10391183,57226721646,Cell cost mind best cup task.
10.1109/ICICIS58388.2023.10391183,57206206494,Attorney safe office pass actually care ok.
10.1109/ICICIS58388.2023.10391183,57193254778,Camera difficult strong stuff century.
10.1109/TIFS.2023.3280742,57194724290,Director apply without short six Congress all.
10.1109/TIFS.2023.3280742,57189240238,Have game wonder. Back drug provide success.
10.1109/TIFS.2023.3280742,27867794600,Property human star law window.
10.1186/s12859-024-05634-8,58317933000,But every thing strategy fast TV protect.
10.1186/s12859-024-05634-8,56984291600,Most family billion power practice.
10.1186/s12859-024-05634-8,57200603870,Authority represent bad scene to.
10.1145/3555041.3590816,57201418237,Rule rest difficult herself.
10.1145/3555041.3590816,58961107500,Doctor product a whose central.
10.1145/3555041.3590816,57216410031,Crime value measure exist civil.
10.2478/amns.2023.2.01470,7402420191,Just where between try consider figure any.
10.2478/amns.2023.2.01470,8707999600,Establish wait only know compare recent indeed.
10.2478/amns.2023.2.01470,16041797800,Middle else bad should.
10.1016/j.eswa.2024.123388,58509140000,So right relate family approach beat or.
10.1016/j.eswa.2024.123388,58817889500,That bit stop else year Congress should toward.
10.1016/j.eswa.2024.123388,55676195200,Week medical police yourself win oil later.
10.5194/isprs-archives-XLVIII-1-W1-2023-311-2023,58544283600,Before laugh I figure important who.
10.5194/isprs-archives-XLVIII-1-W1-2023-311-2023,58833237000,Impact few couple offer office.
10.5194/isprs-archives-XLVIII-1-W1-2023-311-2023,58698801700,Pick seat reflect budget particular.
10.1145/3631802.3631821,57194010534,Wrong computer a measure law scientist want.
10.1145/3631802.3631821,18439025900,Six far prepare be entire toward allow.
10.1145/3631802.3631821,58861355000,Bring policy early ever baby growth.
10.1145/3545945.3569727,56308141500,Star yet they figure fact year must.
10.1145/3545945.3569727,57214072491,Against sort his account place end fly.
10.1145/3545945.3569727,58896666100,Five wish product.
10.1109/SUMMA60232.2023.10349498,35772439500,Dinner modern agent director somebody.
10.1109/SUMMA60232.2023.10349498,58950242600,Point since goal entire catch.
10.1109/SUMMA60232.2023.10349498,57203385925,Tv investment citizen strong last moment.
10.1109/BIOSIG58226.2023.10345997,58089293200,Inside nothing the visit adult team will.
10.1109/BIOSIG58226.2023.10345997,54407264800,Small them quickly.
10.1109/BIOSIG58226.2023.10345997,58921373400,Car economy amount them. Agency with get.
10.1145/3609956.3609968,7403269252,Type good man across sister recent.
10.1145/3609956.3609968,57214882041,Question reveal art ahead.
10.1145/3609956.3609968,58833180900,Blue suddenly civil policy various.
10.1016/j.jbi.2024.104603,57847538800,Those democratic already crime.
10.1016/j.jbi.2024.104603,57357587900,Local arm purpose bill.
10.1016/j.jbi.2024.104603,57204180035,Whom audience later age might.
10.1145/3592980.3595300,58682135700,Democrat child nation perhaps.
10.1145/3592980.3595300,57274970100,Drug exist piece event trade as.
10.1145/3592980.3595300,58179258300,Day him product bar traditional.
10.1109/SSI58917.2023.10387755,58911604600,Special effort public mind course.
10.1109/SSI58917.2023.10387755,58904707800,Will decade government eight list.
10.1109/SSI58917.2023.10387755,57209781010,Traditional hair street system direction color.
10.1016/j.cmpb.2024.108117,56388458400,Cost drop decade of say stock.
10.1016/j.cmpb.2024.108117,7404666882,Mouth lawyer character seven.
10.1016/j.cmpb.2024.108117,50861109400,Tough size pressure door very again adult series.
10.1021/acs.jcim.3c00870,57217578727,Decade bag report by according attack difference.
10.1021/acs.jcim.3c00870,58081521100,Mother half recognize although culture mission.
10.1021/acs.jcim.3c00870,58909164900,Especially house protect turn side most.
10.3390/s24041259,58711505100,Second treatment why quite.
10.3390/s24041259,26660863200,Door car open real.
10.3390/s24041259,57203231767,Help know successful other face.
10.1007/s11633-022-1402-8,57221545847,Treatment similar hundred change.
10.1007/s11633-022-1402-8,57204302200,Can off born. Sea power source rich throw.
10.1007/s11633-022-1402-8,6603741790,Indeed firm share traditional increase sometimes.
10.5194/isprs-archives-XLVIII-4-W6-2022-261-2023,58911493400,Hand firm buy strong.
10.5194/isprs-archives-XLVIII-4-W6-2022-261-2023,55581726800,Treatment subject another sing environmental.
10.5194/isprs-archives-XLVIII-4-W6-2022-261-2023,58847414500,Street skill just relate any head fill.
10.1016/j.csbj.2024.01.013,57226597377,Their sell so woman tough assume.
10.1016/j.csbj.2024.01.013,56429704200,Others bit at if.
10.1016/j.csbj.2024.01.013,56013451000,Family shake especially any year quite.
10.3233/JIFS-231852,58945365900,Wear room simply figure like without at.
10.3233/JIFS-231852,56030205300,Floor nature sea trouble certain.
10.3233/JIFS-231852,57196350081,Miss available right factor next.
10.1109/ACCESS.2024.3362247,55318683200,Somebody blue you card true eye their sense.
10.1109/ACCESS.2024.3362247,58812953300,Yet ask summer nearly wear rich.
10.1109/ACCESS.2024.3362247,55466824600,Box weight remember mouth exactly forget.
10.1007/s11042-023-17013-1,58814446900,Mr voice authority.
10.1007/s11042-023-17013-1,58927575900,Someone research such short international reason.
10.1007/s11042-023-17013-1,57216226904,Wife in source nature tax out.
10.26615/978-954-452-090-8_002,58889154600,Pass citizen hand.
10.26615/978-954-452-090-8_002,56303521100,New other north bag.
10.26615/978-954-452-090-8_002,58706880900,Increase mind rather generation issue.
10.1007/s00521-023-09296-0,57223906180,Well less yes possible account.
10.1007/s00521-023-09296-0,58919549100,Skill huge believe city political camera.
10.1007/s00521-023-09296-0,58158865900,Admit drug majority against sign nearly.
10.1109/CANDARW60564.2023.00013,53264913500,Enter way identify generation state try.
10.1109/CANDARW60564.2023.00013,57190341207,Decision simple future scientist less air take.
10.1109/CANDARW60564.2023.00013,57238778900,Check art set sense back.
10.1109/CIPAE60493.2023.00019,57878835100,Big day eye be. Citizen mouth tough wait.
10.1109/CIPAE60493.2023.00019,57211142666,Only actually home visit.
10.1109/CIPAE60493.2023.00019,58889362100,Special maybe subject next produce people piece.
10.1145/3581641.3584067,57221545344,Agency middle song girl maintain.
10.1145/3581641.3584067,57209289122,Increase lawyer move. Analysis will garden left.
10.1145/3581641.3584067,58918740400,Improve cost save thank laugh book five.
10.23919/SICE59929.2023.10354252,57221483642,Support fish walk position yard development.
10.23919/SICE59929.2023.10354252,55819860600,Clearly score since ground fill.
10.23919/SICE59929.2023.10354252,57212779493,Official sit same early three enough.
10.1016/j.conengprac.2024.105843,23986475800,Officer end develop hand mouth tonight current.
10.1016/j.conengprac.2024.105843,58913976700,Form talk tell rather key return occur future.
10.1016/j.conengprac.2024.105843,9041881000,Structure be back.
10.1002/sam.11673,58303631300,Represent so feeling fire draw.
10.1002/sam.11673,57453675700,Executive return in.
10.1002/sam.11673,58544283600,Serious both hope western.
10.1145/3615890.3628537,6504773964,Business stay whose. Feel above party mind.
10.1145/3615890.3628537,57279381600,Tell card take network.
10.1145/3615890.3628537,57462149300,Them mother bank where century when late.
10.1109/ACCESS.2024.3357689,57208737479,Bag seat sometimes blood kid military.
10.1109/ACCESS.2024.3357689,6601985288,Soldier after month number despite send bit cold.
10.1109/ACCESS.2024.3357689,56431754000,Machine at far idea thought.
10.1109/IISEC59749.2023.10391023,35368074500,Involve support yard dream approach tax.
10.1109/IISEC59749.2023.10391023,57817685500,She thank amount nature article.
10.1109/IISEC59749.2023.10391023,55696014000,Because so central build reality.
10.1109/ICRAMET60171.2023.10366632,58347601600,My him model.
10.1109/ICRAMET60171.2023.10366632,57218545987,Town day time speak.
10.1109/ICRAMET60171.2023.10366632,57900446500,Enjoy reach perform data home if business.
10.1007/s10489-023-05172-5,58793334300,Understand rich rise culture product step idea.
10.1007/s10489-023-05172-5,56903681300,Light area identify past young.
10.1007/s10489-023-05172-5,57224084178,Fight such plant use present major.
10.1016/j.compgeo.2023.105934,57218844070,Speak book eye option allow bed.
10.1016/j.compgeo.2023.105934,7004510847,Measure buy radio fine several determine.
10.1016/j.compgeo.2023.105934,42961909600,Involve top open lose. Family walk whether glass.
10.1145/3615522.3615529,7004510847,Thousand ball stage whom despite.
10.1145/3615522.3615529,57201870645,Smile begin during store since trouble.
10.1145/3615522.3615529,58618232300,Traditional add significant somebody.
10.1016/j.csi.2023.103801,57216223382,You key usually lawyer girl.
10.1016/j.csi.2023.103801,57408665500,Image appear possible media.
10.1016/j.csi.2023.103801,8395934400,Water price player.
10.1109/VizSec60606.2023.00011,58850477900,Own shoulder hot test cup land. Series need soon.
10.1109/VizSec60606.2023.00011,8886024500,This east church again.
10.1109/VizSec60606.2023.00011,56133752400,Simply try doctor body establish.
10.1109/IEMENTech60402.2023.10423485,57189098382,College step hard serious newspaper tend.
10.1109/IEMENTech60402.2023.10423485,58513342200,Move claim discuss stop cover event.
10.1109/IEMENTech60402.2023.10423485,7201894059,Car fast indeed interest.
10.1016/j.comtox.2024.100304,58144915300,Occur rock southern turn issue clearly operation.
10.1016/j.comtox.2024.100304,57211684710,Space floor east form.
10.1016/j.comtox.2024.100304,56528635300,Religious up generation right war partner.
10.1145/3583133.3590662,8417985000,Gas race top action push about.
10.1145/3583133.3590662,58137972800,Boy try article own figure marriage.
10.1145/3583133.3590662,55210018400,Market fund throughout imagine easy candidate.
10.1145/3583120.3586957,57207622221,Note too source billion six decade.
10.1145/3583120.3586957,57216886887,Need a court affect reality see memory call.
10.1145/3583120.3586957,36611050300,Close happen prove street save situation win yes.
10.1145/3576841.3589614,57566721900,Medical design budget type assume church.
10.1145/3576841.3589614,58809613300,Finally live keep one.
10.1145/3576841.3589614,57219503860,Bring gun Congress indicate cut.
10.3390/s24031008,58859175000,Trade mention notice enjoy teacher fund.
10.3390/s24031008,14632337000,Father available drop parent end.
10.3390/s24031008,57196370079,Necessary author experience police head foreign.
10.1145/3555041.3590817,58838367800,Speech upon serve produce.
10.1145/3555041.3590817,36450747100,Onto dark maintain light environment federal.
10.1145/3555041.3590817,57207880544,Chair focus police around.
10.1109/NKCon59507.2023.10396396,57225850005,Wife available security benefit born fund bed.
10.1109/NKCon59507.2023.10396396,57191335413,Good collection idea some during chance watch.
10.1109/NKCon59507.2023.10396396,57372236700,Indeed unit speak field way job.
10.3233/JIFS-223030,56707940700,Happen when shoulder southern prove just last.
10.3233/JIFS-223030,57944921500,Say shoulder use support.
10.3233/JIFS-223030,7005988072,Seem story crime plan despite hard.
10.1109/ICTBIG59752.2023.10456144,57216585545,Together myself cover toward.
10.1109/ICTBIG59752.2023.10456144,57204302200,Peace happy top cover.
10.1109/ICTBIG59752.2023.10456144,53264599300,Kid lot son might open create.
10.1109/BIOSIG58226.2023.10345977,55625223000,Discover detail nice writer factor.
10.1109/BIOSIG58226.2023.10345977,58796189800,Group against growth under fill read.
10.1109/BIOSIG58226.2023.10345977,58795926000,Cut store natural include majority president.
10.1109/IJCB57857.2023.10448552,57210241290,Trade man one join occur budget.
10.1109/IJCB57857.2023.10448552,7405365838,Add again degree war former.
10.1109/IJCB57857.2023.10448552,57203787545,Best kid brother.
10.1109/TBIOM.2024.3377686,55837873400,Surface skill dog body theory say foreign.
10.1109/TBIOM.2024.3377686,56146379100,Partner have full for marriage different.
10.1109/TBIOM.2024.3377686,6602366061,Around agreement recently response.
10.1016/j.procs.2023.12.042,56180337500,Together from grow energy.
10.1016/j.procs.2023.12.042,55451797100,Smile lead finally citizen.
10.1016/j.procs.2023.12.042,57761347700,Organization toward option wind about again.
10.1109/MNET.2024.3374080,55717945400,Vote room foot issue opportunity describe.
10.1109/MNET.2024.3374080,55560792500,Night rise daughter. Voice partner still project.
10.1109/MNET.2024.3374080,6602366061,Something find nice key week.
10.3233/ATDE221245,57209412512,Often family arrive.
10.3233/ATDE221245,55533844800,Every nice blue glass play behind air.
10.3233/ATDE221245,57486195600,Leader right believe.
10.1201/9781032684994-76,57427316900,Laugh most go should foot second order citizen.
10.1201/9781032684994-76,57193573228,Picture without once wait.
10.1201/9781032684994-76,58752093300,Animal whole purpose against television.
10.1109/ICSSS58085.2023.10407074,55504846600,Store story stay budget whom.
10.1109/ICSSS58085.2023.10407074,57219856368,Any somebody let Congress.
10.1109/ICSSS58085.2023.10407074,36071504600,My Democrat fine.
10.1145/3572848.3577433,56153214300,Major know language contain meeting.
10.1145/3572848.3577433,6602448188,Approach against its less share possible next.
10.1145/3572848.3577433,57970372300,After consumer low little wait itself case firm.
10.1109/ICDSAAI59313.2023.10452571,57224980204,Language Mr could everyone strong laugh agency.
10.1109/ICDSAAI59313.2023.10452571,58679216900,Develop idea themselves tell.
10.1109/ICDSAAI59313.2023.10452571,26867687500,A phone peace wind tell.
10.1145/3615887.3627753,58833237000,Important down organization such.
10.1145/3615887.3627753,9232733100,He recent study argue.
10.1145/3615887.3627753,58155030300,Away other author laugh home oil again.
10.1109/HPEC58863.2023.10363590,7201437359,I myself wall.
10.1109/HPEC58863.2023.10363590,57561904100,Also enough movement usually.
10.1109/HPEC58863.2023.10363590,55725641500,None story trouble less.
10.1007/s00521-024-09577-2,57226499433,World bad could.
10.1007/s00521-024-09577-2,58667843600,Line exist individual.
10.1007/s00521-024-09577-2,8845369100,Possible president amount cup feeling area.
10.48786/edbt.2023.53,6507045792,Lot class from.
10.48786/edbt.2023.53,24071859600,Nation time finally event pattern letter door.
10.48786/edbt.2023.53,57220482267,Character spring near well. Again stuff feel old.
10.1109/PuneCon58714.2023.10450006,55625223000,Sell cup much lot. Position cell purpose author.
10.1109/PuneCon58714.2023.10450006,57397625900,Surface seat party face agreement those.
10.1109/PuneCon58714.2023.10450006,57580070400,Receive southern soldier list voice range.
10.3390/s24051698,58889101100,Wall win pass real control window detail three.
10.3390/s24051698,56902540800,Important anything night agent on if federal.
10.3390/s24051698,57761347700,Rate because subject sound safe to your poor.
10.1145/3589462.3589488,58835671300,Lead particular yes world.
10.1145/3589462.3589488,57695820100,List throughout born see class myself.
10.1145/3589462.3589488,55538865600,Teach case light personal lead set relationship.
,47861564100,Sing when middle deep not along.
,43061445600,East item PM subject affect bit all.
,57686265800,Understand site time analysis professor.
10.1038/s41524-023-01193-3,57043667600,Large image occur fire while few power.
10.1038/s41524-023-01193-3,56603389700,This within several themselves meet plan.
10.1038/s41524-023-01193-3,58942296400,Present difficult poor more something.
10.4230/LIPIcs.ICDT.2023.12,57709845600,Not form decide best her.
10.4230/LIPIcs.ICDT.2023.12,9534854100,Participant method key against.
10.4230/LIPIcs.ICDT.2023.12,58549184000,Operation end program necessary.
10.4230/LIPIcs.ICDT.2023.3,58591381700,Few free offer son raise.
10.4230/LIPIcs.ICDT.2023.3,57211998742,Foot accept if nation recently.
10.4230/LIPIcs.ICDT.2023.3,57355296500,My treat near well indicate yet.
10.4230/LIPIcs.ICDT.2023.19,58942416100,Little spring wind difficult.
10.4230/LIPIcs.ICDT.2023.19,55318683200,Town eye group anything say.
10.4230/LIPIcs.ICDT.2023.19,57198850029,Million cell high dream main.
10.4230/LIPIcs.ICDT.2023.20,58904662100,Few blood whom us human camera hand.
10.4230/LIPIcs.ICDT.2023.20,57195305974,Ball catch reduce about billion half.
10.4230/LIPIcs.ICDT.2023.20,57208737479,At beautiful toward apply.
10.4230/LIPIcs.ICDT.2023.10,57210899175,Industry through arrive. Mr speech property pass.
10.4230/LIPIcs.ICDT.2023.10,57884306500,Court forward they will.
10.4230/LIPIcs.ICDT.2023.10,57211088189,Event almost politics step range.
10.1016/j.eswa.2023.122754,57193434099,Entire discuss important. Parent stage build run.
10.1016/j.eswa.2023.122754,6603136018,Process type step late.
10.1016/j.eswa.2023.122754,57212779493,Her might you environment.
10.1145/3614321.3614381,57203496287,Security dog similar small admit.
10.1145/3614321.3614381,58810726400,Say sign age available.
10.1145/3614321.3614381,7102202806,Night later final money entire.
10.1016/j.engappai.2023.107500,58771087900,Week candidate age or true.
10.1016/j.engappai.2023.107500,57219767826,Follow job serve pass difference you.
10.1016/j.engappai.2023.107500,7403171805,Still general team central run.
,58882708600,Woman spring everybody.
,57485180600,Chance necessary pretty report.
,57212561878,Whom want century administration serious.
10.1109/COMNETSAT59769.2023.10420796,58950242600,Deal agency score child accept.
10.1109/COMNETSAT59769.2023.10420796,57218545987,Front difficult decision dog wide.
10.1109/COMNETSAT59769.2023.10420796,57218294008,Nice receive build wide point they.
10.1007/s11042-024-18488-2,58567078600,Already speech relate speak.
10.1007/s11042-024-18488-2,58919154500,Land paper defense report. Trip member score.
10.1007/s11042-024-18488-2,57213021063,Soldier radio son.
10.1016/j.bspc.2023.105899,58179116100,Bad help administration art history continue dog.
10.1016/j.bspc.2023.105899,56388458400,Move away occur gas finish true gun.
10.1016/j.bspc.2023.105899,57946022500,Cost send total eat their page.
10.1016/j.calphad.2023.102658,56287884800,Last listen perform pull.
10.1016/j.calphad.2023.102658,57197115321,Agent guy nation along why.
10.1016/j.calphad.2023.102658,10141380000,Approach may agree with cold his claim.
10.1016/j.compbiomed.2024.108124,58868103200,Even project police thing arrive.
10.1016/j.compbiomed.2024.108124,57003736200,Including risk lose security environmental guess.
10.1016/j.compbiomed.2024.108124,57217122619,It action nature gas.
10.1109/ICOIACT59844.2023.10455894,57202836473,Necessary I south when. West heart fear car.
10.1109/ICOIACT59844.2023.10455894,56230937800,Eat have mouth picture over.
10.1109/ICOIACT59844.2023.10455894,57296186600,Determine message rest realize.
10.1016/j.compbiomed.2024.108195,7005065755,During upon grow.
10.1016/j.compbiomed.2024.108195,58085817800,Job there better right its service ever.
10.1016/j.compbiomed.2024.108195,57196579609,Buy garden race myself public machine price.
10.1109/IW_MSS59200.2023.10368597,56303521100,Present court wrong sing.
10.1109/IW_MSS59200.2023.10368597,7201996437,Herself though citizen.
10.1109/IW_MSS59200.2023.10368597,58847656200,Fly of probably skill instead her.
10.1145/3592980.3595304,57218106668,Person rest film next. Light police may chair.
10.1145/3592980.3595304,57192938047,Those poor put require happen.
10.1145/3592980.3595304,22634069200,Environmental once purpose evening want ok real.
10.1145/3592980.3595317,55650978700,Opportunity positive your hand force.
10.1145/3592980.3595317,57220011737,Operation him mother collection.
10.1145/3592980.3595317,24829518000,Out worry guy media thought share mean.
10.1007/s00500-023-09418-9,57216591230,Nice make add value with garden.
10.1007/s00500-023-09418-9,58920439600,Forward list try people.
10.1007/s00500-023-09418-9,57193576827,Hot wife evidence spring happen bring let.
10.1016/j.jfranklin.2024.106664,57211108673,Both field city than inside.
10.1016/j.jfranklin.2024.106664,58896666100,Human firm increase even. Move whose size have.
10.1016/j.jfranklin.2024.106664,56230937800,Know student chair guess movement.
10.1109/C358072.2023.10436245,56388458400,But evidence what old.
10.1109/C358072.2023.10436245,8571819900,Book goal film way with finally there.
10.1109/C358072.2023.10436245,44860895000,Pressure total second.
10.1109/TIP.2023.3333217,58911493400,Worry too Republican black medical.
10.1109/TIP.2023.3333217,56707940700,School prove avoid get item.
10.1109/TIP.2023.3333217,58725013200,Bed factor bring skin maintain view leg.
