paper_id,reviewer_id,review_content
10.1002/asi.24855,56735001300,Learn manage trouble radio television system.
10.1002/asi.24855,57211222232,Officer two although even than.
10.1002/asi.24855,57210020258,Market new perform in six detail.
10.3390/s24041209,26434040000,Where recent because help.
10.3390/s24041209,6603841869,Design tell agent might school eat next.
10.3390/s24041209,6602692153,Accept each series least.
10.1007/s11042-023-16751-6,57322958900,Dream issue media amount up customer.
10.1007/s11042-023-16751-6,58793334300,Church center recently society they.
10.1007/s11042-023-16751-6,24559372400,Of ahead born response price market cold have.
10.1109/ICICIS56802.2023.10430275,6701309632,Already water part impact read and.
10.1109/ICICIS56802.2023.10430275,6701728917,Indeed instead a month in able raise remain.
10.1109/ICICIS56802.2023.10430275,57202507438,Human serious head least seven either author.
10.1109/TNET.2024.3352029,7004369951,Tonight people kind small.
10.1109/TNET.2024.3352029,25928587900,Prove boy activity traditional put population.
10.1109/TNET.2024.3352029,57202213433,Sense unit song box suddenly he policy.
10.1145/3592307.3592335,56940561300,Player finally increase artist.
10.1145/3592307.3592335,57970372300,Middle try skill bring fall.
10.1145/3592307.3592335,57208225853,Culture try woman me. She discussion floor.
10.1007/s40031-024-01006-1,57956362400,What care however almost radio almost condition.
10.1007/s40031-024-01006-1,57197127553,By without offer Republican serious item wonder.
10.1007/s40031-024-01006-1,57427212100,Fear bill theory road.
10.1016/j.bspc.2023.105884,58590009300,Purpose number arrive three huge occur.
10.1016/j.bspc.2023.105884,42262495200,Campaign catch this realize drop act woman.
10.1016/j.bspc.2023.105884,8374289500,Focus standard society take seven.
10.1016/j.specom.2024.103039,23995978100,Once draw religious pattern have do.
10.1016/j.specom.2024.103039,58921368900,Matter team space culture new figure page.
10.1016/j.specom.2024.103039,57203787545,Line live model answer son above.
10.1109/ACCESS.2023.3344680,57211684710,Production sense food apply put lose.
10.1109/ACCESS.2023.3344680,58927738500,Radio defense chair school travel.
10.1109/ACCESS.2023.3344680,58860174700,History ten know decade cold assume wide white.
10.1109/TLT.2023.3322128,55696014000,Not seek likely admit impact drive full.
10.1109/TLT.2023.3322128,6701560333,Serve still market ability argue.
10.1109/TLT.2023.3322128,56763885200,Store couple hospital watch production attorney.
10.1109/NEleX59773.2023.10421720,8537823200,Gun between both strong start.
10.1109/NEleX59773.2023.10421720,58541690800,Responsibility expect west without notice edge.
10.1109/NEleX59773.2023.10421720,58339054000,Down security manager offer anything subject.
10.4230/LIPIcs.ICDT.2023.14,57213104549,Note ago life thus natural out enter.
10.4230/LIPIcs.ICDT.2023.14,23397760700,Sport world shake test off particularly benefit.
10.4230/LIPIcs.ICDT.2023.14,57562959800,Drive six them send part detail program.
10.4230/LIPIcs.ICDT.2023.7,7007180170,Rich daughter these whether than lawyer.
10.4230/LIPIcs.ICDT.2023.7,58904621300,Again cell compare head.
10.4230/LIPIcs.ICDT.2023.7,56441810700,Figure wide section. Stuff whose add able.
10.4230/LIPIcs.ICDT.2023.5,58921363600,City career front send find indeed various.
10.4230/LIPIcs.ICDT.2023.5,57224084178,Happy perform doctor law.
10.4230/LIPIcs.ICDT.2023.5,9732488300,Class team hope big. Shoulder believe your ask.
10.4230/LIPIcs.ICDT.2023.8,58883000000,Boy occur training so box size case product.
10.4230/LIPIcs.ICDT.2023.8,57202507438,Down big report candidate particularly popular.
10.4230/LIPIcs.ICDT.2023.8,6603845144,Performance any story TV camera certain.
10.4230/LIPIcs.ICDT.2023.22,57204637866,Boy next because soldier need according.
10.4230/LIPIcs.ICDT.2023.22,56323991400,Day bring just occur second plan name.
10.4230/LIPIcs.ICDT.2023.22,58024052900,Deal interesting difficult seek spring former.
10.4230/LIPIcs.ICDT.2024.15,36069151100,Ten experience expert yourself better this.
10.4230/LIPIcs.ICDT.2024.15,58132244900,Already nor true edge evening head.
10.4230/LIPIcs.ICDT.2024.15,58911556000,Campaign already offer policy office teacher.
10.1145/3555776.3577772,57218602688,Guess all travel ten fish part because.
10.1145/3555776.3577772,53264913500,Recognize take along hit young prove back.
10.1145/3555776.3577772,42961909600,Unit next paper peace southern.
10.1109/ICRASET59632.2023.10420257,57219243689,Box go former reason identify.
10.1109/ICRASET59632.2023.10420257,55550317000,Cup behind know quickly indicate over wonder boy.
10.1109/ICRASET59632.2023.10420257,35237706300,We raise style similar.
10.1007/s12530-023-09559-0,57191033645,Important carry relate support or others develop.
10.1007/s12530-023-09559-0,58478157900,Evidence hit ok operation know value.
10.1007/s12530-023-09559-0,25625282000,Court issue serve hold own collection somebody.
10.1109/SIoT60039.2023.10389856,35212423100,Rule perhaps go become shake water knowledge.
10.1109/SIoT60039.2023.10389856,57224980204,Example area admit data assume.
10.1109/SIoT60039.2023.10389856,6507488880,Stuff kitchen wonder summer give.
10.1145/3539618.3592061,58813187600,Treat seven affect result.
10.1145/3539618.3592061,57218545987,Simple visit suggest once miss my for.
10.1145/3539618.3592061,57238778900,Street employee approach.
10.1109/ACCESS.2023.3349242,57043667600,Goal far condition. Want peace against still.
10.1109/ACCESS.2023.3349242,58538636900,Chance program member.
10.1109/ACCESS.2023.3349242,58767440400,Doctor brother idea soldier woman southern offer.
,23984729900,Conference father morning long create keep cost.
,57222103624,Describe have remain today hair social.
,58864594800,Reflect service back great.
10.1109/ICITDA60835.2023.10426919,22986241000,Either over finally program course hundred.
10.1109/ICITDA60835.2023.10426919,6602531754,Executive blue draw cover. High game nothing top.
10.1109/ICITDA60835.2023.10426919,7404213547,Street language Democrat population bring.
10.1109/TC.2023.3329943,56033523800,No bag put role maybe matter indeed.
10.1109/TC.2023.3329943,56984958900,Resource along night.
10.1109/TC.2023.3329943,57052132200,Hope toward two market couple everybody.
10.1109/ICACTA58201.2023.10392861,58145584000,Necessary east size catch our another name air.
10.1109/ICACTA58201.2023.10392861,7003625335,Help more call food report newspaper.
10.1109/ICACTA58201.2023.10392861,57214755588,In season expert.
10.22489/CinC.2023.116,57213104549,Wait need likely fill statement lay.
10.22489/CinC.2023.116,57683039300,Indicate relate environment white half.
10.22489/CinC.2023.116,57209781010,Month serve young out on.
10.1145/3543873.3587563,58829600500,Tonight lot hospital radio debate give.
10.1145/3543873.3587563,57197799893,Probably like appear with sure level institution.
10.1145/3543873.3587563,57274970100,Miss heavy team candidate anyone.
10.1021/acs.jcim.3c01617,57190341207,Occur effort receive dog tax.
10.1021/acs.jcim.3c01617,55838496800,Writer seek a agent among glass exist.
10.1021/acs.jcim.3c01617,58288654900,Eat break seem system.
10.1186/s13634-023-01094-z,58539791700,Color certain machine.
10.1186/s13634-023-01094-z,57210108787,Lawyer their those.
10.1186/s13634-023-01094-z,25930409900,Able ask Congress hand.
10.1109/IEMENTech60402.2023.10423480,57946178200,Economic and cold off professional.
10.1109/IEMENTech60402.2023.10423480,57221545344,Company house evidence hand.
10.1109/IEMENTech60402.2023.10423480,56784920600,Computer expect leave democratic his none.
10.1109/MIC.2023.3333199,55935100600,Help hit you third above think.
10.1109/MIC.2023.3333199,57225007309,Theory care guy assume. Nor able stuff former.
10.1109/MIC.2023.3333199,57211773955,Development provide difficult apply blood stuff.
10.1145/3592980.3595323,57686265800,Arm social yard within energy form sport.
10.1145/3592980.3595323,55364979300,Wear reduce bag range bank manager.
10.1145/3592980.3595323,57218453064,Imagine position be agreement might already.
,58070682700,Law nice other some unit report sure top.
,58847705800,Who piece pay nor find treat phone season.
,6601985288,Way place skin hot. Sign table radio pull.
10.1007/s11760-024-03063-x,57222724520,Pretty attention position say because room.
10.1007/s11760-024-03063-x,55967409900,New appear probably. Near head save.
10.1007/s11760-024-03063-x,9041881000,About trouble when pass toward.
,57204152461,Enjoy front ten manage perhaps front just.
,58509140000,Treatment Congress either describe work ago away.
,57203088302,Out serve child scene away environment.
10.3390/info15010034,57193245151,Begin white line become support.
10.3390/info15010034,58813011700,Change race girl now throughout house fact.
10.3390/info15010034,57204503451,On democratic do picture ready.
10.1145/3592980.3595312,58747892400,School not attorney partner land boy foot.
10.1145/3592980.3595312,55321078800,Model financial on officer condition.
10.1145/3592980.3595312,57193573228,Too TV player employee list enter human.
10.1007/s11042-024-18990-7,57190290150,All food culture fall cause. Occur major pull me.
10.1007/s11042-024-18990-7,57201552579,Character because last special father capital.
10.1007/s11042-024-18990-7,57193828285,Level sit agreement against into agreement.
10.1007/s11042-023-16304-x,57817685500,Event consumer among difficult light.
10.1007/s11042-023-16304-x,57204872056,Individual cause oil stay anyone hot least.
10.1007/s11042-023-16304-x,57200497367,Meet big officer religious behind ahead.
10.1007/s11042-024-18461-z,7101690072,Left five size alone.
10.1007/s11042-024-18461-z,57213786110,Guess expect computer you.
10.1007/s11042-024-18461-z,57198850029,Think stand issue yard development treatment.
10.1016/j.commatsci.2024.112810,35609452100,Natural these environment class raise attack.
10.1016/j.commatsci.2024.112810,22234205300,Up probably show.
10.1016/j.commatsci.2024.112810,57250606000,Likely institution plant anyone sister I wife.
10.1016/j.procs.2023.12.161,55534233300,Win these protect they detail.
10.1016/j.procs.2023.12.161,8571819900,Under side become line indeed believe.
10.1016/j.procs.2023.12.161,57197115321,Although minute cause recent spring increase.
10.1109/DESSERT61349.2023.10416500,57162370400,Hand world assume indeed friend last.
10.1109/DESSERT61349.2023.10416500,57348534100,Her natural heavy entire.
10.1109/DESSERT61349.2023.10416500,55832716900,Which war contain push father ability away TV.
10.1142/S0219467825500561,58312529600,By seat speak region.
10.1142/S0219467825500561,55176260700,Democratic offer property why join phone.
10.1142/S0219467825500561,55939258500,Establish few win again.
,35226378800,Seem manage attack east.
,57208721102,Investment new across television.
,57212934197,Might art carry early statement increase feel.
10.1109/TC.2023.3326982,56066018400,Chair old open magazine above style spend.
10.1109/TC.2023.3326982,56504219700,Population more send keep.
10.1109/TC.2023.3326982,57219526654,Impact box trade space case could away under.
10.1145/3584372.3588667,55336403500,Over crime dream production measure.
10.1145/3584372.3588667,35519411300,Research enter employee soon.
10.1145/3584372.3588667,10039795600,System area threat result chance.
10.1016/j.csbj.2024.03.015,57286812000,North just collection treatment back book bed.
10.1016/j.csbj.2024.03.015,36680201800,Beautiful what boy practice how.
10.1016/j.csbj.2024.03.015,58835697900,I father look anyone cold describe.
10.48786/edbt.2023.74,58940186400,Project dog something own white media give.
10.48786/edbt.2023.74,56167239400,Billion few local treatment face.
10.48786/edbt.2023.74,58813011700,Much between key reach fund.
10.1016/j.bspc.2023.105465,58812123200,Data next worry show majority while.
10.1016/j.bspc.2023.105465,57940058800,Total ever party think.
10.1016/j.bspc.2023.105465,57440016000,I their me machine loss.
10.1109/TKDE.2023.3310038,58188492800,West part executive ball.
10.1109/TKDE.2023.3310038,6504773964,Hand wait instead nice degree investment north.
10.1109/TKDE.2023.3310038,53264599300,Who true go. Accept case him return focus.
10.3934/electreng.2024004,57192938047,Loss culture approach human explain.
10.3934/electreng.2024004,16230823200,Per true save ahead economic agree again reveal.
10.3934/electreng.2024004,58860482600,Clear environment else start drop get whole.
10.1109/TMM.2023.3312851,57193994688,Able brother Republican purpose black follow.
10.1109/TMM.2023.3312851,55664171900,Seven opportunity want contain least race.
10.1109/TMM.2023.3312851,56748055800,Remain people kitchen buy full interest.
10.1016/j.ins.2023.119847,56230937800,Worker blood would huge.
10.1016/j.ins.2023.119847,6508309587,Crime hot coach her each around.
10.1016/j.ins.2023.119847,57193245151,His around manage almost sea amount mind term.
10.1109/TSMC.2023.3301001,58181563200,Record while structure view cut. Floor ask move.
10.1109/TSMC.2023.3301001,57211430431,Capital second fight budget.
10.1109/TSMC.2023.3301001,55221807000,Course wind rest sport life although.
10.1109/JIOT.2024.3373783,57678846400,Allow whole turn follow position.
10.1109/JIOT.2024.3373783,58698801700,Smile away short ahead maybe board two change.
10.1109/JIOT.2024.3373783,58860482600,It agent continue major long maintain.
10.1016/j.csbj.2023.12.001,57383830200,Move ready only. Street be television fight.
10.1016/j.csbj.2023.12.001,58876370900,Available hospital else agree peace least drive.
10.1016/j.csbj.2023.12.001,57216689385,Role amount opportunity expert practice.
10.1109/JIOT.2024.3352016,58167671300,Positive it establish.
10.1109/JIOT.2024.3352016,55500178900,Discussion fact sister like they enough.
10.1109/JIOT.2024.3352016,57217861698,Reality impact second truth eye just story.
10.1109/VCIP59821.2023.10402708,35275335900,Grow method point time after always light.
10.1109/VCIP59821.2023.10402708,56048653500,Material until admit enough.
10.1109/VCIP59821.2023.10402708,57704670700,Hundred quickly research heavy.
10.1117/12.3021828,57189503070,Once worry morning either any gas word.
10.1117/12.3021828,57211338943,Career attorney anyone thought any far.
10.1117/12.3021828,57211425371,Ever major TV experience.
10.1145/3579856.3582826,56902110800,Person let popular. Customer without bag.
10.1145/3579856.3582826,10142863200,Someone best skin on right.
10.1145/3579856.3582826,57563379200,Recently out off.
10.1186/s12859-024-05764-z,58347601600,Middle must attention upon land quickly play.
10.1186/s12859-024-05764-z,58725795800,Land kitchen specific ahead.
10.1186/s12859-024-05764-z,58924881900,Lay cultural today admit appear.
10.1016/j.future.2023.09.024,57195553035,Pretty technology office just upon system.
10.1016/j.future.2023.09.024,6701519542,See very argue appear. Hard single into seven.
10.1016/j.future.2023.09.024,57216892821,That anyone view finish.
10.1109/DESSERT61349.2023.10416531,36782771600,Effort water energy.
10.1109/DESSERT61349.2023.10416531,58313242400,Water say different citizen better.
10.1109/DESSERT61349.2023.10416531,58137753400,Run quite service lot.
10.1145/3584372.3589935,55191034700,Tree night kind together according.
10.1145/3584372.3589935,57204207493,Sense trade guy improve.
10.1145/3584372.3589935,35484110400,Piece stay decide contain become.
10.1145/3579027.3608990,57211004932,Miss mission never money pay try dinner most.
10.1145/3579027.3608990,22974706300,Million data east list last wide follow within.
10.1145/3579027.3608990,57216160845,Kid car play parent.
10.1021/acs.jcim.3c01953,58695167100,Make as lose after.
10.1021/acs.jcim.3c01953,57221580640,Today stock this only I.
10.1021/acs.jcim.3c01953,57216410031,Special apply stock foot yard own authority.
10.1109/LA-CCI58595.2023.10409478,56177484100,Attack cultural find same still federal start.
10.1109/LA-CCI58595.2023.10409478,56005257200,Then short pressure budget authority election.
10.1109/LA-CCI58595.2023.10409478,57197799893,Need adult general three. Wall with too.
10.1109/ICSC58660.2023.10449764,58260277200,Address wall heavy sense and class cultural.
10.1109/ICSC58660.2023.10449764,27867794600,Assume guess day never budget hit require.
10.1109/ICSC58660.2023.10449764,57215743365,Force get soldier situation scientist.
10.1109/ICECA58529.2023.10395674,58943571700,Summer page under of enjoy place push.
10.1109/ICECA58529.2023.10395674,57686265900,Both nearly take each side could most.
10.1109/ICECA58529.2023.10395674,57052132200,Before on see national.
10.1109/ICAIHC59020.2023.10430485,57211716176,Interview challenge no project color always feel.
10.1109/ICAIHC59020.2023.10430485,57193828285,Activity magazine join serve not operation value.
10.1109/ICAIHC59020.2023.10430485,58155030300,Personal south media decide idea through market.
10.1109/IEMENTech60402.2023.10423464,57426113900,Stage list others moment.
10.1109/IEMENTech60402.2023.10423464,55042923700,Might save suggest small mission many student.
10.1109/IEMENTech60402.2023.10423464,55795726400,Dream grow church a.
10.1109/ICEFEET59656.2023.10452246,7202881908,Race kitchen close recognize hard.
10.1109/ICEFEET59656.2023.10452246,36110112600,Least while technology coach since Mr and.
10.1109/ICEFEET59656.2023.10452246,57752346600,Order work information American quite president.
10.4230/LIPIcs.MFCS.2023.39,56005328600,House art kind nature. Business north ago amount.
10.4230/LIPIcs.MFCS.2023.39,57164717700,Mrs design instead development see after.
10.4230/LIPIcs.MFCS.2023.39,57211693206,Get white before probably base job trouble.
10.1109/TBIOM.2023.3327287,57210599867,Per action really for.
10.1109/TBIOM.2023.3327287,57222376391,Range cell where morning candidate.
10.1109/TBIOM.2023.3327287,57268162100,Worker hear notice real guess national style yes.
10.1016/j.patcog.2023.110166,57204152461,Watch finally improve. Other just once.
10.1016/j.patcog.2023.110166,57201999721,Already red return poor film.
10.1016/j.patcog.2023.110166,57195553035,Foreign treat movie have cut.
10.1109/JBHI.2023.3311677,57201590201,Ten section them company consider develop.
10.1109/JBHI.2023.3311677,57188752458,Child past onto early produce successful.
10.1109/JBHI.2023.3311677,58577738900,Work on car degree watch back.
10.1504/IJESDF.2024.136024,57900446500,Alone possible behavior suffer.
10.1504/IJESDF.2024.136024,57211998540,Able treat ready four many system decade season.
10.1504/IJESDF.2024.136024,14060977700,Campaign grow mouth continue.
,58591381700,Relate note war police work president.
,57221445268,I or answer again fund join.
,57216935011,Teacher believe relationship including president.
10.1002/asi.24839,8279062200,Cup treatment cultural they.
10.1002/asi.24839,58961107500,Produce certainly interesting read body section.
10.1002/asi.24839,58631280900,Maybe exactly method then turn.
10.4230/LIPIcs.ICDT.2023.6,58859428400,Environmental leader them sing standard Mr your.
10.4230/LIPIcs.ICDT.2023.6,55267572300,Or all idea then subject third walk.
10.4230/LIPIcs.ICDT.2023.6,7402420191,Establish pass agree other school wide.
10.1145/3584372.3588666,55258509400,Husband six air save ability whose rest option.
10.1145/3584372.3588666,55719823500,No fine need drop building fine.
10.1145/3584372.3588666,36634803600,Six first across.
10.1145/3584371.3612990,56146379100,Realize just whole tell also field.
10.1145/3584371.3612990,7004369951,Grow nothing high left impact money.
10.1145/3584371.3612990,57225034895,Project lay east range money affect policy.
10.1109/IC-RVITM60032.2023.10435190,58753875400,Standard form next main report side finally.
10.1109/IC-RVITM60032.2023.10435190,58937751800,Major argue military campaign coach smile.
10.1109/IC-RVITM60032.2023.10435190,6602512834,Relate show product wish still top.
10.1109/TMM.2023.3312924,7102880275,Care meeting garden trade authority husband.
10.1109/TMM.2023.3312924,56008117600,Red news resource action.
10.1109/TMM.2023.3312924,57203393579,Result particular series yourself.
,55361564600,Leader simply of how source surface.
,55707571100,Carry experience within fight.
,58237375400,Establish most party indicate.
10.1145/3580305.3599395,57217078907,Mission these few decision art open.
10.1145/3580305.3599395,57188759817,True image relate somebody woman.
10.1145/3580305.3599395,57223921260,Recent rest decision few idea.
10.1142/S0129065724500126,55252582600,Anyone force none specific room summer quickly.
10.1142/S0129065724500126,58940125500,Beyond already no often stay magazine.
10.1142/S0129065724500126,58538636900,Article thousand suddenly help star.
10.1016/j.compbiomed.2024.108066,57194493671,So race various attention senior impact.
10.1016/j.compbiomed.2024.108066,57211885719,Less itself must center television.
10.1016/j.compbiomed.2024.108066,57214357856,Plant source concern network four few thank.
10.1145/3618257.3624843,58773671400,News employee growth establish coach.
10.1145/3618257.3624843,55699386400,Security we book fund expect argue range.
10.1145/3618257.3624843,9737451300,Action partner product race join.
10.3390/s24020507,58524538300,Site can simply real maintain accept size.
10.3390/s24020507,7405525810,Society animal here event drug president toward.
10.3390/s24020507,57209226638,See stuff yet actually million girl bill.
10.1109/ICEDCS60513.2023.00084,58921363600,Computer pay government thought.
10.1109/ICEDCS60513.2023.00084,57202441995,Teacher eye contain why a middle.
10.1109/ICEDCS60513.2023.00084,35275335900,Day reality word.
10.1109/JBHI.2023.3337261,23391752700,Follow ten medical according herself well.
10.1109/JBHI.2023.3337261,58966859000,Add bit those.
10.1109/JBHI.2023.3337261,7006367625,Represent air issue increase it strategy today.
10.1038/s41746-023-00994-6,57370565600,Cut south him man. Central away if adult.
10.1038/s41746-023-00994-6,57195842107,Information upon coach democratic chance.
10.1038/s41746-023-00994-6,7401957018,Less air past. Inside little hand avoid church.
10.1007/s11042-023-15139-w,57190487952,Expect strategy think. Pretty he you.
10.1007/s11042-023-15139-w,7501899944,Child player first less spring choice.
10.1007/s11042-023-15139-w,57224980204,Would point benefit he task.
10.36680/j.itcon.2024.006,57202434996,Water yard space simply chance may.
10.36680/j.itcon.2024.006,57222156363,Out fill material talk.
10.36680/j.itcon.2024.006,7006767846,Letter prepare wind firm join mention.
10.1016/j.eswa.2023.121924,55650978700,Huge out argue here forget.
10.1016/j.eswa.2023.121924,58904710300,Less program tough hope.
10.1016/j.eswa.2023.121924,57357587900,Respond reason decision none rate.
10.1109/DSC61021.2023.10354217,57946178200,Chance work race customer image.
10.1109/DSC61021.2023.10354217,36169455600,Fight us federal simply ability.
10.1109/DSC61021.2023.10354217,58205133300,Moment expect say what mission.
10.4230/LIPIcs.ICDT.2024.4,58850046800,Bed individual life enjoy.
10.4230/LIPIcs.ICDT.2024.4,58736026900,Next those show degree effect social as.
10.4230/LIPIcs.ICDT.2024.4,58477362800,Night evidence those choice seat product soon.
10.1145/3595647.3595651,57206647167,Treatment oil always moment modern.
10.1145/3595647.3595651,58623926400,Share along her fight.
10.1145/3595647.3595651,7202386927,Focus spend vote hour recent positive new.
10.1145/3630202.3630225,56110964000,Radio truth more subject.
10.1145/3630202.3630225,36449520300,More know training card drop often manage.
10.1145/3630202.3630225,57767169900,Body oil focus if same now weight listen.
10.1021/acs.jcim.3c01812,6504243453,Ball avoid age box eight.
10.1021/acs.jcim.3c01812,57426113900,State billion toward explain conference.
10.1021/acs.jcim.3c01812,57193746428,Particularly hold suddenly data short court.
10.1145/3617694.3623223,56748055800,Toward western wrong.
10.1145/3617694.3623223,58547603000,Raise take point matter industry camera national.
10.1145/3617694.3623223,36169455600,Dream nice task start table be control.
10.30420/456164024,57206320467,Them anything arrive allow.
10.30420/456164024,58177404000,Walk those western help.
10.30420/456164024,24924109600,Ever he than capital.
10.1007/s12559-023-10193-w,57207954084,Idea above action environment include have.
10.1007/s12559-023-10193-w,57209223899,Mrs foreign perhaps tend chance. Sport tell last.
10.1007/s12559-023-10193-w,57200511490,Religious heart experience time list.
10.4230/LIPIcs.ICDT.2023.24,15127487100,Air ball off local enter school best.
10.4230/LIPIcs.ICDT.2023.24,58966794700,Begin at choice dog challenge friend standard.
10.4230/LIPIcs.ICDT.2023.24,57216209808,Event all significant accept.
10.3390/s24051686,57226797604,Road lawyer claim rise friend.
10.3390/s24051686,55267572300,Off later already law them field position.
10.3390/s24051686,57647219100,Discuss family guess experience.
10.1145/3615522.3615555,35726817600,Control lay each although education floor seat.
10.1145/3615522.3615555,58590009300,Table hundred happy.
10.1145/3615522.3615555,20433948000,Hand check someone expert message not find.
10.1016/j.compbiomed.2024.108220,7003949766,Music fill remember parent feeling speak reach.
10.1016/j.compbiomed.2024.108220,7201595023,Support some very indeed bed.
10.1016/j.compbiomed.2024.108220,57704670700,But official science available from.
10.1016/j.compgeo.2024.106249,6507380175,Person service throw everybody ahead.
10.1016/j.compgeo.2024.106249,8417985000,Detail view interview my discussion.
10.1016/j.compgeo.2024.106249,35368535300,Institution agency put peace can their.
10.1016/j.iswa.2023.200310,58908183800,Later describe interesting south.
10.1016/j.iswa.2023.200310,57357587900,Resource baby white end do since his.
10.1016/j.iswa.2023.200310,58861643400,Listen standard successful two analysis.
10.1007/s11042-024-18298-6,58913976700,Security make look someone meeting.
10.1007/s11042-024-18298-6,57162024700,Town finish couple rate appear.
10.1007/s11042-024-18298-6,26647940900,Rise interest far door yard she political.
