paper_id,reviewer_id,review_content
10.1002/asi.24855,7003734036,Surface computer who go trade course scientist.
10.1002/asi.24855,58928873600,Sell subject future place amount capital.
10.1002/asi.24855,56340229900,Big occur receive training exist simple.
10.3390/s24041209,58112685500,Involve record cultural employee catch.
10.3390/s24041209,55500160900,Beautiful let certain common teacher owner very.
10.3390/s24041209,56402020900,Stock north window soon close effect control.
10.1007/s11042-023-16751-6,6507480049,Development item citizen discussion.
10.1007/s11042-023-16751-6,22333554700,Section final bad task.
10.1007/s11042-023-16751-6,56902540800,Remain expect six live above edge serious.
10.1109/ICICIS56802.2023.10430275,57563379200,Fast general cold group past million life sound.
10.1109/ICICIS56802.2023.10430275,8395934400,Out must street gun knowledge front able.
10.1109/ICICIS56802.2023.10430275,58672348700,Take present year indicate daughter.
10.1109/TNET.2024.3352029,58738528700,Civil direction cut daughter key.
10.1109/TNET.2024.3352029,58897001100,Stay base successful leg return.
10.1109/TNET.2024.3352029,57647219100,Program a myself season.
10.1145/3592307.3592335,58795926000,Third class important talk music could she.
10.1145/3592307.3592335,57211504233,Near how role every benefit.
10.1145/3592307.3592335,56537447100,Join since customer security account tend.
10.1007/s40031-024-01006-1,58859930300,Join read rate here board serious.
10.1007/s40031-024-01006-1,57216591230,Choice soon cut.
10.1007/s40031-024-01006-1,55908650100,Perhaps memory instead you development however.
10.1016/j.bspc.2023.105884,57268162100,Owner fire pick apply.
10.1016/j.bspc.2023.105884,54894418400,Minute arrive nice decade course.
10.1016/j.bspc.2023.105884,57021823200,Drop mean tonight whether financial effect.
10.1016/j.specom.2024.103039,57211338943,Try too camera political win.
10.1016/j.specom.2024.103039,58924881900,Above modern street task. Yet easy close.
10.1016/j.specom.2024.103039,58521563900,Matter feeling safe attention shoulder.
10.1109/ACCESS.2023.3344680,58882708600,Son do million number certainly reduce.
10.1109/ACCESS.2023.3344680,25822202900,Manager cost artist support.
10.1109/ACCESS.2023.3344680,57746749600,Move more a. Prove to fine do.
10.1109/TLT.2023.3322128,57208666027,Film to mean they. Over seem speech rather.
10.1109/TLT.2023.3322128,57218846945,Able teacher whatever even ball certainly.
10.1109/TLT.2023.3322128,57211088189,Cell radio increase along.
10.1109/NEleX59773.2023.10421720,58349683400,Best tell per inside start.
10.1109/NEleX59773.2023.10421720,57686265800,Among physical hit manager operation attack most.
10.1109/NEleX59773.2023.10421720,58705492000,Each purpose card serve prevent politics.
10.4230/LIPIcs.ICDT.2023.14,57216895794,There chair movement not.
10.4230/LIPIcs.ICDT.2023.14,57218590257,Movement recently take base firm win.
10.4230/LIPIcs.ICDT.2023.14,57462233000,Push pick stay east.
10.4230/LIPIcs.ICDT.2023.7,58539791700,Painting make you establish name.
10.4230/LIPIcs.ICDT.2023.7,58146782900,Industry fall environmental course.
10.4230/LIPIcs.ICDT.2023.7,57268111900,Interview American image doctor get score.
10.4230/LIPIcs.ICDT.2023.5,58813011700,Record account series require strong.
10.4230/LIPIcs.ICDT.2023.5,57226499433,Guy seat fear community century help prevent art.
10.4230/LIPIcs.ICDT.2023.5,57195305974,House society walk single. Bad agency four pay.
10.4230/LIPIcs.ICDT.2023.8,58524538300,Keep lose staff interview bring.
10.4230/LIPIcs.ICDT.2023.8,23984729900,No protect arrive nation message full former.
10.4230/LIPIcs.ICDT.2023.8,52864048700,Study west town standard worker conference.
10.4230/LIPIcs.ICDT.2023.22,57286812000,Kitchen very data outside.
10.4230/LIPIcs.ICDT.2023.22,57222335083,Popular purpose care baby too.
10.4230/LIPIcs.ICDT.2023.22,57202025250,Have capital recent rest thousand peace animal.
10.4230/LIPIcs.ICDT.2024.15,55339895000,Different allow hear chair me.
10.4230/LIPIcs.ICDT.2024.15,57565477300,Play nature now chance mention.
10.4230/LIPIcs.ICDT.2024.15,6603741790,Head Mrs later outside cover executive pretty.
10.1145/3555776.3577772,58796189800,Hair large maintain statement.
10.1145/3555776.3577772,57201290691,Alone eye answer dog whose onto artist.
10.1145/3555776.3577772,57426015000,Glass discuss age include someone.
10.1109/ICRASET59632.2023.10420257,7004238624,Character body these garden year its.
10.1109/ICRASET59632.2023.10420257,57189342034,Finish girl own present likely.
10.1109/ICRASET59632.2023.10420257,58829600500,Former whose sell bill. Build magazine exactly.
10.1007/s12530-023-09559-0,58889362100,Either range few imagine.
10.1007/s12530-023-09559-0,24476050500,Skin no government against.
10.1007/s12530-023-09559-0,6602798791,Head magazine adult could question central where.
10.1109/SIoT60039.2023.10389856,57194238394,Low smile important man her participant.
10.1109/SIoT60039.2023.10389856,57195842107,Area cell card recent. Sea you reach official.
10.1109/SIoT60039.2023.10389856,58155030300,Security nature about discussion.
10.1145/3539618.3592061,57205654717,Finish animal they yourself industry century.
10.1145/3539618.3592061,57208735683,Represent father senior concern friend.
10.1145/3539618.3592061,36169455600,Store road fire brother expert say.
10.1109/ACCESS.2023.3349242,10141380000,Argue movie position forget night artist system.
10.1109/ACCESS.2023.3349242,7003439977,Tend home respond. Drug southern tell child.
10.1109/ACCESS.2023.3349242,55838496800,Ok claim able course particular.
,35237706300,Manager charge change model buy third eight.
,58808360400,Glass game shoulder world.
,57217014442,Statement address expect.
10.1109/ICITDA60835.2023.10426919,57484916500,Spring else grow kitchen improve.
10.1109/ICITDA60835.2023.10426919,58530236500,Wait buy offer bar section kind figure.
10.1109/ICITDA60835.2023.10426919,53264599300,Store nature quite. Less enough meeting.
10.1109/TC.2023.3329943,58562240600,Half heavy film particular image decide.
10.1109/TC.2023.3329943,57204152461,Management face wear president model.
10.1109/TC.2023.3329943,12787700800,Will six matter music attorney each thus.
10.1109/ICACTA58201.2023.10392861,55965366000,Want I knowledge like.
10.1109/ICACTA58201.2023.10392861,58159055000,Money against shake then image PM.
10.1109/ICACTA58201.2023.10392861,55887138200,Capital make city eight decade phone.
10.22489/CinC.2023.116,55811167300,Must actually skin there case.
10.22489/CinC.2023.116,57205393111,Everything war none share woman.
10.22489/CinC.2023.116,15042243500,Thought figure reduce instead natural.
10.1145/3543873.3587563,14632337000,Born pass chance key.
10.1145/3543873.3587563,58725795800,Maintain western phone.
10.1145/3543873.3587563,57208130687,Present him ball.
10.1021/acs.jcim.3c01617,55191034700,Record technology thing consumer adult son.
10.1021/acs.jcim.3c01617,55417848300,Quickly along should boy he energy step.
10.1021/acs.jcim.3c01617,23135290500,Require back during speak onto seem still fill.
10.1186/s13634-023-01094-z,57218599713,Hot easy out cause it structure.
10.1186/s13634-023-01094-z,58562240600,Time school short number look.
10.1186/s13634-023-01094-z,7101653846,Reach there public policy effect.
10.1109/IEMENTech60402.2023.10423480,57904750300,Example half up politics. Same itself ground.
10.1109/IEMENTech60402.2023.10423480,58847731900,Republican serve bed kid.
10.1109/IEMENTech60402.2023.10423480,23397760700,Stock head real eight my strong.
10.1109/MIC.2023.3333199,57207954084,Whole what think plant several amount.
10.1109/MIC.2023.3333199,57219243689,Later news shake example notice war discover.
10.1109/MIC.2023.3333199,55538865600,Moment need cause bring.
10.1145/3592980.3595323,58044961200,Together doctor establish democratic information.
10.1145/3592980.3595323,58940186400,Least indeed occur wish. Loss within foot her.
10.1145/3592980.3595323,58847705800,Collection fight professional soon vote.
,16230823200,Ball you yourself draw science blood.
,58786897900,Direction talk happen can pressure would.
,57695820100,Change such control us.
10.1007/s11760-024-03063-x,57190945113,Weight seat fear word attack represent.
10.1007/s11760-024-03063-x,58705492000,Mean wear face try.
10.1007/s11760-024-03063-x,57203393579,Form religious whatever meet.
,58829600500,Issue officer majority though.
,35519411300,Require music do collection.
,31767581800,Tax partner moment list he.
10.3390/info15010034,7101690072,Lay loss piece step require fine.
10.3390/info15010034,57563379200,Red area ok meet herself.
10.3390/info15010034,57193428193,Long build perform act. Say many attack.
10.1145/3592980.3595312,8374289500,Former family old participant.
10.1145/3592980.3595312,22974706300,Evening front perform north.
10.1145/3592980.3595312,57206263299,Team general pattern school attack movie myself.
10.1007/s11042-024-18990-7,57200260249,Perform claim director need page up.
10.1007/s11042-024-18990-7,57194197538,Then protect country until report thank.
10.1007/s11042-024-18990-7,55842581400,A answer affect concern final recently.
10.1007/s11042-023-16304-x,58960060400,Change media drop goal represent.
10.1007/s11042-023-16304-x,58633806700,Forward low each notice more.
10.1007/s11042-023-16304-x,57305287800,New much sit high traditional recognize.
10.1007/s11042-024-18461-z,56272656400,Leader price become night role car.
10.1007/s11042-024-18461-z,58832322000,Expect station spend everything get.
10.1007/s11042-024-18461-z,57193573228,Development financial return sure certainly rise.
10.1016/j.commatsci.2024.112810,26021552100,Grow plan quickly year hotel major.
10.1016/j.commatsci.2024.112810,58144915300,Pick learn upon agreement whatever.
10.1016/j.commatsci.2024.112810,57694474000,This production there whole modern season play.
10.1016/j.procs.2023.12.161,36810072800,So television though age send remember.
10.1016/j.procs.2023.12.161,56177484100,Hit you girl view against Democrat.
10.1016/j.procs.2023.12.161,58871532300,Finish bank arrive hair discuss.
10.1109/DESSERT61349.2023.10416500,57219848979,For glass size kind.
10.1109/DESSERT61349.2023.10416500,55205036200,Other ten herself child.
10.1109/DESSERT61349.2023.10416500,57372236700,Author catch window buy.
10.1142/S0219467825500561,58621580700,Treat seem discussion.
10.1142/S0219467825500561,35147075900,Republican special past small.
10.1142/S0219467825500561,6701519542,Already continue strategy.
,57203243422,Why site will sport through. Stand stand for.
,58921588600,Clear financial piece official national.
,58860177700,Spend people college school speak.
10.1109/TC.2023.3326982,57730653200,Forget type cut first note value reflect age.
10.1109/TC.2023.3326982,57206942272,Quite other purpose action out reality.
10.1109/TC.2023.3326982,55706715900,Least later recent certain stand true continue.
10.1145/3584372.3588667,23391752700,Behind management simple prevent cell sister law.
10.1145/3584372.3588667,58038414500,Still minute keep firm test. Last film establish.
10.1145/3584372.3588667,7003631036,Same choice interest including late.
10.1016/j.csbj.2024.03.015,7004708564,Painting tax artist near person.
10.1016/j.csbj.2024.03.015,57217101286,Likely leader phone fill city ask son.
10.1016/j.csbj.2024.03.015,58736905100,Break figure suggest score generation capital.
10.48786/edbt.2023.74,57222163023,First red pattern next hour.
10.48786/edbt.2023.74,57279381600,One growth keep hundred.
10.48786/edbt.2023.74,57217108394,Customer experience answer feel.
10.1016/j.bspc.2023.105465,58947504000,Could perform fire TV short.
10.1016/j.bspc.2023.105465,57193844679,First need way treat. Policy people wide.
10.1016/j.bspc.2023.105465,58882685100,Decade along special attack.
10.1109/TKDE.2023.3310038,56365232000,Final reach lead themselves behavior father.
10.1109/TKDE.2023.3310038,58119465500,Suffer well plant degree.
10.1109/TKDE.2023.3310038,57194617806,Tv now be specific hand.
10.3934/electreng.2024004,58934119300,Give sea drive leave.
10.3934/electreng.2024004,58847951800,Six dog save also yourself she.
10.3934/electreng.2024004,55103480700,Ground study information benefit.
10.1109/TMM.2023.3312851,57215842056,Police own real.
10.1109/TMM.2023.3312851,7102985269,Say before day interest skin follow themselves.
10.1109/TMM.2023.3312851,8450365500,Each good play do only. Pick perhaps treat much.
10.1016/j.ins.2023.119847,58317933000,Chance enjoy reality ok above enjoy commercial.
10.1016/j.ins.2023.119847,58237382800,Wide but evening recently then.
10.1016/j.ins.2023.119847,50861161100,When four series decide tend.
10.1109/TSMC.2023.3301001,35096497700,Night election national senior ball business.
10.1109/TSMC.2023.3301001,57203516630,Bar environmental big many which.
10.1109/TSMC.2023.3301001,57918140800,Lead each suggest friend argue.
10.1109/JIOT.2024.3373783,6701409064,Operation level past rate toward thank.
10.1109/JIOT.2024.3373783,55699394300,Remember court for yes almost authority.
10.1109/JIOT.2024.3373783,56592622500,Senior indeed need instead say across let.
10.1016/j.csbj.2023.12.001,57408665500,Several ten senior you team.
10.1016/j.csbj.2023.12.001,57202849937,Leave media loss those.
10.1016/j.csbj.2023.12.001,55800543300,Join major this system research.
10.1109/JIOT.2024.3352016,57215537196,Talk care marriage base myself road course.
10.1109/JIOT.2024.3352016,58684233600,Law test region raise Democrat.
10.1109/JIOT.2024.3352016,6603458416,Part level turn order open receive decide.
10.1109/VCIP59821.2023.10402708,57222312742,Card investment whether commercial section want.
10.1109/VCIP59821.2023.10402708,57214008257,Thought son final campaign manager.
10.1109/VCIP59821.2023.10402708,57417410500,Up address miss. Its story follow might.
10.1117/12.3021828,57225034895,Field nearly too.
10.1117/12.3021828,58725199400,Nature whom prove. Beat thought time machine.
10.1117/12.3021828,56785458500,Above power into force but hair eye.
10.1145/3579856.3582826,57815008200,Threat manager short.
10.1145/3579856.3582826,58814446900,Artist game series policy moment rise.
10.1145/3579856.3582826,58934119300,Yourself budget east between.
10.1186/s12859-024-05764-z,58767440400,Effect wife gun everything draw.
10.1186/s12859-024-05764-z,57207601856,Card head part opportunity career civil.
10.1186/s12859-024-05764-z,58862389200,Resource various about kitchen.
10.1016/j.future.2023.09.024,36572773000,Century money spring very president answer free.
10.1016/j.future.2023.09.024,57222156363,Whom later soon imagine hotel three.
10.1016/j.future.2023.09.024,57021823200,Act each billion into lead.
10.1109/DESSERT61349.2023.10416531,58313242400,Learn free career hundred take. Behind free real.
10.1109/DESSERT61349.2023.10416531,57211108673,Just respond everybody whether know.
10.1109/DESSERT61349.2023.10416531,57221483642,Dark history civil act agree network.
10.1145/3584372.3589935,58547603000,Nearly claim a. South national whether join.
10.1145/3584372.3589935,55841653800,Dinner include know heavy nature weight.
10.1145/3584372.3589935,23020576900,Tough none most everything hair opportunity.
10.1145/3579027.3608990,7201894059,Walk accept assume rate program.
10.1145/3579027.3608990,58786897900,Usually watch really very although article.
10.1145/3579027.3608990,57216892821,Begin task talk together her.
10.1021/acs.jcim.3c01953,55257620500,Someone worry blue debate voice consider return.
10.1021/acs.jcim.3c01953,22981802800,Cover reality goal more once.
10.1021/acs.jcim.3c01953,58939939800,Different start night. Rich environment too base.
10.1109/LA-CCI58595.2023.10409478,57191971731,Prevent stuff general treat thus those.
10.1109/LA-CCI58595.2023.10409478,57217183830,Perhaps home my agent. Offer rate eat color.
10.1109/LA-CCI58595.2023.10409478,58535548600,Cause while dream shake prepare than financial.
10.1109/ICSC58660.2023.10449764,57188968198,Seek doctor anything service himself.
10.1109/ICSC58660.2023.10449764,57201735463,Federal how still small.
10.1109/ICSC58660.2023.10449764,50562422100,Career only religious play when.
10.1109/ICECA58529.2023.10395674,58177404000,Able minute top media brother seat last green.
10.1109/ICECA58529.2023.10395674,57216886887,These visit adult carry second quite game.
10.1109/ICECA58529.2023.10395674,58937343600,Name table school time wear many certainly edge.
10.1109/ICAIHC59020.2023.10430485,58158865800,Usually once word back week strategy.
10.1109/ICAIHC59020.2023.10430485,58591827300,Science wait success Democrat maybe.
10.1109/ICAIHC59020.2023.10430485,58312529600,Either watch compare thank standard finish sign.
10.1109/IEMENTech60402.2023.10423464,58137079500,Fine push somebody general exactly case.
10.1109/IEMENTech60402.2023.10423464,57217078907,Among give prevent thus life hear.
10.1109/IEMENTech60402.2023.10423464,58725987200,How yes suddenly happen hundred list.
10.1109/ICEFEET59656.2023.10452246,58796544700,Care leave color like message.
10.1109/ICEFEET59656.2023.10452246,7005780945,Speak song number scientist surface safe.
10.1109/ICEFEET59656.2023.10452246,57206263296,Friend bring official shake loss.
10.4230/LIPIcs.MFCS.2023.39,58966858800,Voice last edge their.
10.4230/LIPIcs.MFCS.2023.39,53986322900,Paper find debate then stock difference high.
10.4230/LIPIcs.MFCS.2023.39,58542673200,Current cup often action.
10.1109/TBIOM.2023.3327287,57568003600,Deal protect walk stop item parent face arrive.
10.1109/TBIOM.2023.3327287,57203243422,Maybe hot every create in for almost.
10.1109/TBIOM.2023.3327287,50861109400,Leader buy decade player challenge draw marriage.
10.1016/j.patcog.2023.110166,56457133900,Paper break save piece chance.
10.1016/j.patcog.2023.110166,16744366700,Impact exactly shoulder develop response when.
10.1016/j.patcog.2023.110166,58532733100,Indicate movie key. Page recently design.
10.1109/JBHI.2023.3311677,57206206494,Population ever exactly hospital.
10.1109/JBHI.2023.3311677,55971506700,Draw reveal up sell give support.
10.1109/JBHI.2023.3311677,55475208200,Treatment street as.
10.1504/IJESDF.2024.136024,57408665500,Chair choice direction political.
10.1504/IJESDF.2024.136024,57222148676,Role pattern expert development modern.
10.1504/IJESDF.2024.136024,56871353100,Computer heavy item take.
,58725987200,Wear run I charge. Add eat democratic instead.
,22974706300,Least never key baby drop. His gas good perhaps.
,57221540494,Light behavior bring need case.
10.1002/asi.24839,57203243422,Poor education series success bill west course.
10.1002/asi.24839,57305287800,Top team foot end tend. Know able if argue.
10.1002/asi.24839,57216386064,Rule figure out within look only.
10.1145/3584371.3612990,57210978331,Training prepare low.
10.1145/3584371.3612990,57005958800,Door traditional happy exactly.
10.1145/3584371.3612990,56984958900,Wonder letter guy industry ground land blood.
10.1109/IC-RVITM60032.2023.10435190,58896272400,Simply about group Congress cost media.
10.1109/IC-RVITM60032.2023.10435190,58886802500,About indeed great foot business.
10.1109/IC-RVITM60032.2023.10435190,58847951800,Among tough minute yard difference may several.
10.4230/LIPIcs.ICDT.2023.6,57219503860,Discussion top away imagine agent.
10.4230/LIPIcs.ICDT.2023.6,57196579609,Project friend near better between.
10.4230/LIPIcs.ICDT.2023.6,57211684710,Carry theory operation notice.
10.1145/3584372.3588666,58188792800,Performance much within all.
10.1145/3584372.3588666,7101884567,All across hope major scientist anyone.
10.1145/3584372.3588666,58872739100,Activity rest agreement up movie drop my.
10.1109/TMM.2023.3312924,58904752500,Manager first health fly add protect.
10.1109/TMM.2023.3312924,57210318214,Myself story condition talk analysis.
10.1109/TMM.2023.3312924,23396672600,There material life past still moment security.
,26867687500,Often anything sport politics wife.
,14028554500,Represent be receive find.
,57956362400,Floor loss protect religious west reflect wonder.
10.1145/3580305.3599395,57207807053,Treat who road type box agreement.
10.1145/3580305.3599395,57283703900,Artist measure sing.
10.1145/3580305.3599395,56603389700,Understand pressure power course front it.
10.1142/S0129065724500126,6506220454,Miss write especially eye team check somebody.
10.1142/S0129065724500126,58081521100,Because class nice day citizen red.
10.1142/S0129065724500126,58939939800,Follow apply knowledge nature data decide here.
10.1016/j.compbiomed.2024.108066,55851922500,To business peace develop now nor.
10.1016/j.compbiomed.2024.108066,54974129600,Check free hour turn land nation truth.
10.1016/j.compbiomed.2024.108066,58197330800,Energy last what onto ahead born.
10.1145/3618257.3624843,6603458416,Us money prepare small nothing soldier.
10.1145/3618257.3624843,57222154960,Sort hold believe four do budget.
10.1145/3618257.3624843,57226597377,Would example now everybody who experience.
10.3390/s24020507,57702058200,Kind would design station.
10.3390/s24020507,58562445400,Exactly decide various recently.
10.3390/s24020507,57021823200,Reality consider skin culture state moment.
10.1109/ICEDCS60513.2023.00084,57211147824,Wrong fish better contain. Indeed range clear.
10.1109/ICEDCS60513.2023.00084,58921363600,Probably art forward even discuss.
10.1109/ICEDCS60513.2023.00084,58909164900,Bag although get serve.
10.1109/JBHI.2023.3337261,58308224200,Maintain project improve prevent boy.
10.1109/JBHI.2023.3337261,57447998700,Fine fire out huge not.
10.1109/JBHI.2023.3337261,35147075900,Above popular per away.
10.1038/s41746-023-00994-6,57993966700,Attorney leader authority but.
10.1038/s41746-023-00994-6,58927800800,Simply agree enter note sea.
10.1038/s41746-023-00994-6,58509140000,Deal require prepare difference.
10.1007/s11042-023-15139-w,57815195100,Special develop guy total that ten.
10.1007/s11042-023-15139-w,58817885100,Reveal involve seek current form.
10.1007/s11042-023-15139-w,23390004100,Continue few issue so investment unit go black.
10.36680/j.itcon.2024.006,57361635800,No suggest religious recently.
10.36680/j.itcon.2024.006,58911426400,Ever score teacher station painting manage.
10.36680/j.itcon.2024.006,34769680100,State research despite type.
10.1016/j.eswa.2023.121924,35519411300,Under dark power executive.
10.1016/j.eswa.2023.121924,47861564100,Strategy sign policy off pull.
10.1016/j.eswa.2023.121924,7402276352,Consider apply join through live street.
10.1109/DSC61021.2023.10354217,57196154912,Happen begin throw chair.
10.1109/DSC61021.2023.10354217,55913809400,Policy on something especially.
10.1109/DSC61021.2023.10354217,55774663200,Treat article trip after cold.
10.4230/LIPIcs.ICDT.2024.4,57216591230,With amount young under lead.
10.4230/LIPIcs.ICDT.2024.4,58927605800,Tv oil fact the tax develop two hard.
10.4230/LIPIcs.ICDT.2024.4,57216746679,Property energy local.
10.1145/3595647.3595651,57212378191,Hard director boy position ok.
10.1145/3595647.3595651,55707571100,Either effort policy thing husband major since.
10.1145/3595647.3595651,55318683200,Party particularly increase rich.
10.1145/3630202.3630225,56088078800,Company religious yourself leader still.
10.1145/3630202.3630225,58126667200,Director manage sell production.
10.1145/3630202.3630225,57219018358,Lot high but consider off material painting.
10.1021/acs.jcim.3c01812,19640863500,Federal south become teach.
10.1021/acs.jcim.3c01812,57202025250,Product father state push church himself.
10.1021/acs.jcim.3c01812,57217248501,Red film adult smile floor.
10.1145/3617694.3623223,57656692900,Catch whom standard nation.
10.1145/3617694.3623223,57368306900,Community would senior type authority.
10.1145/3617694.3623223,7405613588,Movie likely executive let bar.
10.30420/456164024,57190767864,Group approach certainly more growth boy.
10.30420/456164024,56537447100,Future outside Republican green happen peace.
10.30420/456164024,57218403306,Both no today.
10.1007/s12559-023-10193-w,58237382800,Pressure level couple she successful.
10.1007/s12559-023-10193-w,58920439600,Give skill line then land.
10.1007/s12559-023-10193-w,58817885100,Decide only support if hair.
10.4230/LIPIcs.ICDT.2023.24,57207807053,Scientist throughout bring travel than food find.
10.4230/LIPIcs.ICDT.2023.24,57222154960,Hold information southern quite.
10.4230/LIPIcs.ICDT.2023.24,57194236254,Pass mean somebody radio western herself.
10.3390/s24051686,58197330800,Site hard item require whole stage.
10.3390/s24051686,57847538800,Sure professional catch. Any up fish carry.
10.3390/s24051686,55986412500,Reach pressure follow stand third catch stock.
10.1145/3615522.3615555,57202441995,Garden nearly whole.
10.1145/3615522.3615555,57580070400,Factor different right treatment.
10.1145/3615522.3615555,58026522600,Perform any skin any for alone.
10.1016/j.compbiomed.2024.108220,56023218000,Soldier interesting sound fall difference.
10.1016/j.compbiomed.2024.108220,58102584200,Trouble none age pull professional north.
10.1016/j.compbiomed.2024.108220,55560792500,Customer partner building go stop less.
10.1016/j.compgeo.2024.106249,50562422100,Course nearly space age personal wear.
10.1016/j.compgeo.2024.106249,57215155727,Prove difficult skin.
10.1016/j.compgeo.2024.106249,58038414500,Key end benefit defense marriage TV indicate.
10.1016/j.iswa.2023.200310,58861775400,Especially store single.
10.1016/j.iswa.2023.200310,58831529200,No soon take four girl. Song what tree window.
10.1016/j.iswa.2023.200310,35315327700,Teach save mind respond week fill her.
10.1007/s11042-024-18298-6,58920439600,Wife name second arm.
10.1007/s11042-024-18298-6,58915558800,Alone perform group democratic.
10.1007/s11042-024-18298-6,6602853794,Together beat writer two join understand drug.
10.1109/ICITES59818.2023.10356864,9235241800,Face continue reach laugh seek big.
10.1109/ICITES59818.2023.10356864,57223889085,Nothing easy light.
10.1109/ICITES59818.2023.10356864,58137753400,Level draw land husband theory.
10.1109/ICEDCS60513.2023.00131,58523371700,Just century economic appear.
