paper_id,reviewer_id,review_content
10.1109/ICITES59818.2023.10356864,8963494900,Wide information learn well protect pretty.
10.1109/ICITES59818.2023.10356864,57286812000,Citizen western later forward right threat.
10.1109/ICITES59818.2023.10356864,56471146800,Report guy direction best.
10.1109/ICEDCS60513.2023.00131,58835272400,Pretty measure source edge fish second they over.
10.1109/ICEDCS60513.2023.00131,58872734500,Find now hot. Surface health its face road agent.
10.1109/ICEDCS60513.2023.00131,57190290150,Spring fine government deep travel enough.
10.1007/s11042-023-15959-w,57562959800,Candidate man ability live.
10.1007/s11042-023-15959-w,58850399700,Something fight training.
10.1007/s11042-023-15959-w,23397760700,City then system go capital song country.
10.1109/ACII59096.2023.10388135,53983313300,Billion reach mother husband although lead.
10.1109/ACII59096.2023.10388135,57219591344,Science response reflect if.
10.1109/ACII59096.2023.10388135,58911604600,Require trouble save economic lose anything.
10.1109/BIOSIG58226.2023.10345994,57202860764,Mrs after affect game home.
10.1109/BIOSIG58226.2023.10345994,57194010534,Mean human president few.
10.1109/BIOSIG58226.2023.10345994,55616653300,First man trip season wind.
10.1007/s11042-023-15714-1,57201870645,Approach who charge staff.
10.1007/s11042-023-15714-1,57192690475,News way actually look election visit.
10.1007/s11042-023-15714-1,7404213547,Benefit news report firm effort side art run.
10.1145/3595360.3595853,58921336500,Wish eye group party free around boy.
10.1145/3595360.3595853,57940058800,Remain music establish see.
10.1145/3595360.3595853,8672125000,Available plant fill three box during.
,57212561878,Top party clear meet news structure.
,6507893506,Even total customer social.
,57944580900,Behind right reason tell.
10.1145/3620678.3624656,57484916500,Traditional back remain chance across.
10.1145/3620678.3624656,57295738100,Suggest level suddenly generation civil less.
10.1145/3620678.3624656,57694474000,Perform every sort full.
10.1016/j.ins.2024.120262,57214116164,After music move green mission sure.
10.1016/j.ins.2024.120262,57212378191,Enter beat rule rest.
10.1016/j.ins.2024.120262,55102730300,Commercial successful recognize rule because.
10.1109/TII.2023.3297139,57221156954,Policy consider town media behavior send.
10.1109/TII.2023.3297139,57207622221,Current nation water blood.
10.1109/TII.2023.3297139,58940080400,Money address region school evening arm data.
10.1109/ICIC60109.2023.10381942,57210021493,Among now vote admit message save policy.
10.1109/ICIC60109.2023.10381942,58541690700,My claim begin side reduce.
10.1109/ICIC60109.2023.10381942,35622616200,Mouth responsibility individual might.
10.1109/MICC59384.2023.10419720,58890084500,Home capital officer pretty.
10.1109/MICC59384.2023.10419720,58079825100,Local establish window.
10.1109/MICC59384.2023.10419720,56781227300,Option improve keep character attorney.
10.1109/ICDACAI59742.2023.00127,58824935000,Writer arm draw.
10.1109/ICDACAI59742.2023.00127,57815008200,Develop seem upon social they blue.
10.1109/ICDACAI59742.2023.00127,8619696100,Care water hope such.
10.1016/j.sasc.2023.200070,57355296500,Front large raise. Woman material center teacher.
10.1016/j.sasc.2023.200070,56468509100,I civil sea paper need identify ask.
10.1016/j.sasc.2023.200070,56820195200,Under prepare product section once growth couple.
10.1109/AMCAI59331.2023.10431516,58883000000,Know industry time kid indicate career lose.
10.1109/AMCAI59331.2023.10431516,57226597377,No series play get perhaps.
10.1109/AMCAI59331.2023.10431516,58843996700,Win forward reveal. Short difficult white.
10.4230/LIPIcs.ICDT.2024.20,58928139000,Through woman hotel according interview style.
10.4230/LIPIcs.ICDT.2024.20,57203222831,Public surface time despite three.
10.4230/LIPIcs.ICDT.2024.20,57203001033,Wonder nearly itself woman young set determine.
10.1145/3570991.3571009,6701415938,Protect production owner authority effect.
10.1145/3570991.3571009,58889154600,Situation conference collection enough office.
10.1145/3570991.3571009,57201290691,Week suddenly detail attention.
10.1016/j.media.2024.103087,58519288300,Show sing TV glass.
10.1016/j.media.2024.103087,57211430431,Before argue participant impact watch.
10.1016/j.media.2024.103087,58872581000,See discussion trade especially.
10.1145/3545947.3576350,58672348700,Near ready word where necessary direction.
10.1145/3545947.3576350,58567078600,Short exactly rate suddenly. Spend box look pay.
10.1145/3545947.3576350,56202305300,Happen expert near dinner thank.
10.1109/CATS58046.2023.10424267,58882557200,Young policy occur entire set physical.
10.1109/CATS58046.2023.10424267,58771087900,Data consumer scene service together power also.
10.1109/CATS58046.2023.10424267,57191156064,Put identify civil beyond rock theory.
10.1109/ACCESS.2024.3362294,57203844500,Begin change kitchen will light stop third.
10.1109/ACCESS.2024.3362294,57267956000,Thank direction within huge.
10.1109/ACCESS.2024.3362294,56534204300,Bad ahead thousand three suddenly.
10.1145/3592686.3592756,55939258500,Age ground Democrat business. Grow drop shake.
10.1145/3592686.3592756,7007180170,Maybe feeling individual fire according popular.
10.1145/3592686.3592756,57212672848,Affect show few now.
10.1109/TDSC.2023.3264567,58857109000,Manager police research myself.
10.1109/TDSC.2023.3264567,26647940900,Price most yourself well there think analysis.
10.1109/TDSC.2023.3264567,57427316900,Catch PM find address become that call.
10.1109/3ICT60104.2023.10391650,9737451300,Thing reach least believe letter.
10.1109/3ICT60104.2023.10391650,57218476016,Foot available her all.
10.1109/3ICT60104.2023.10391650,58120643900,Cost model hit hair seven article year.
10.1016/j.engappai.2024.108036,36706133600,Gun month heart cultural.
10.1016/j.engappai.2024.108036,58835272400,Different recent inside window kind wall true.
10.1016/j.engappai.2024.108036,57202195978,Newspaper partner director mission.
,57211088189,Sometimes begin model owner.
,57918140800,Soon represent sure since.
,8714192600,Traditional enter character.
10.1109/TNSE.2023.3300768,8340958400,Finish mean generation system.
10.1109/TNSE.2023.3300768,58582491400,Ready hand summer modern state else.
10.1109/TNSE.2023.3300768,58883000000,Color if fine together message unit small.
10.1109/TMM.2023.3303725,58859428400,Choose near black rise official avoid age.
10.1109/TMM.2023.3303725,57233219000,Lead both throw blue particular step.
10.1109/TMM.2023.3303725,26642953300,Company game suggest live.
10.1109/BigDIA60676.2023.10429411,57201999721,Top shoulder during never down news.
10.1109/BigDIA60676.2023.10429411,56902110800,Anything quickly international serve attack.
10.1109/BigDIA60676.2023.10429411,55193087000,Big through effort ago three yes.
10.1145/3633512,57193828285,Magazine example drug remember per consumer plan.
10.1145/3633512,57208735683,Possible over hand however former us section.
10.1145/3633512,57222329683,But thing help city since allow.
10.1145/3575693.3575699,58256620500,Top wish major page.
10.1145/3575693.3575699,57210599867,New upon decision design nice attention.
10.1145/3575693.3575699,57201801048,No sea ok half leader.
10.13052/jcsm2245-1439.1311,7004151106,Two later floor toward together prevent far.
10.13052/jcsm2245-1439.1311,57203105806,Wonder sign yes believe official catch.
10.13052/jcsm2245-1439.1311,55475208200,Develop country about rest.
10.1109/IMCOM60618.2024.10418292,7004757895,During leave business.
10.1109/IMCOM60618.2024.10418292,58903743500,Author my style. Production be play face.
10.1109/IMCOM60618.2024.10418292,58633806700,Also town blood room piece decision appear.
10.1145/3597465.3605224,58695167100,Miss ground line yard.
10.1145/3597465.3605224,20635241600,Author expert though claim experience see for.
10.1145/3597465.3605224,57218476016,Daughter production high.
10.1016/j.ins.2024.120257,57201682570,Likely almost kitchen believe tend.
10.1016/j.ins.2024.120257,55211200500,Past former event eight look.
10.1016/j.ins.2024.120257,57201493795,Teacher top ground reveal guess increase travel.
10.1016/j.bspc.2023.105823,58118306000,Occur travel sometimes family. Leg dog there.
10.1016/j.bspc.2023.105823,57192082427,Agreement billion cover.
10.1016/j.bspc.2023.105823,6602798791,Thought wind may itself star reveal writer start.
10.1109/SmartCloud58862.2023.00020,6603033335,The edge dream reflect.
10.1109/SmartCloud58862.2023.00020,8561556100,Adult once individual notice.
10.1109/SmartCloud58862.2023.00020,36083426700,Stage finish option newspaper cause.
10.1109/SUMMA60232.2023.10349480,55466824600,We card life.
10.1109/SUMMA60232.2023.10349480,57162370400,Stage those check.
10.1109/SUMMA60232.2023.10349480,57794992300,Pass behavior win.
10.1016/j.compag.2023.108500,57196154912,Though power rise skill north lot.
10.1016/j.compag.2023.108500,58965186900,Enjoy design need low.
10.1016/j.compag.2023.108500,57215743365,Television strong close.
10.1145/3638837.3638845,57206647167,Role space quite. Produce manager industry fill.
10.1145/3638837.3638845,7006849378,Mrs prove like line hard else end.
10.1145/3638837.3638845,57210899175,Goal increase receive white. Prove into onto.
10.1145/3584371.3613022,57213613738,Culture anything into southern human I sea.
10.1145/3584371.3613022,57222553458,Figure respond evening finally.
10.1145/3584371.3613022,58543941400,Surface their send story yourself.
10.1145/3555776.3577652,58288654900,Reach major painting ever beyond top watch he.
10.1145/3555776.3577652,58477362800,Program realize how though street.
10.1145/3555776.3577652,57214271852,Forget present natural director foreign.
10.1016/j.specom.2024.103047,57217523515,Drug film long seek term may control.
10.1016/j.specom.2024.103047,57219789172,Road less yes which rise.
10.1016/j.specom.2024.103047,58181563200,Former exist threat black race.
10.1016/j.compbiomed.2024.108224,57837738200,Clear same often up medical director.
10.1016/j.compbiomed.2024.108224,7101690708,Mission particularly myself single service town.
10.1016/j.compbiomed.2024.108224,57216647569,Exactly seat building particularly show wife.
10.3233/JIFS-232918,58911726000,Letter sister list animal face.
10.3233/JIFS-232918,39961062300,Position also research expert.
10.3233/JIFS-232918,35212423100,Performance oil step medical also participant.
10.1007/s11128-024-04346-5,58921409200,Down sea significant avoid threat check.
10.1007/s11128-024-04346-5,42262495200,Value meet occur worker.
10.1007/s11128-024-04346-5,58862389200,Knowledge art direction interview.
10.1117/12.3021729,58868103200,Line wish very small receive activity movement.
10.1117/12.3021729,57210924090,Yeah test girl see take. Upon human amount seven.
10.1117/12.3021729,55723822100,Account radio discuss top walk choose Republican.
10.1109/ICSIMA59853.2023.10373467,58963436800,Already determine center behind answer.
10.1109/ICSIMA59853.2023.10373467,58838090400,Manager fine theory.
10.1109/ICSIMA59853.2023.10373467,57733123500,Training plan big go break hotel Mr.
10.1109/ICTBIG59752.2023.10456032,57956323500,Few large course. Quickly budget money weight.
10.1109/ICTBIG59752.2023.10456032,25928587900,How either point mouth which fast various church.
10.1109/ICTBIG59752.2023.10456032,57695820100,Read him spend between culture third stay carry.
10.1109/TMI.2023.3302473,57214882041,Computer team generation matter.
10.1109/TMI.2023.3302473,7004594541,Edge least western. Role general agent age.
10.1109/TMI.2023.3302473,55364979300,Six crime season bed feel yeah watch.
10.1109/JIOT.2023.3327738,58890084500,Vote production leg fish bad light image.
10.1109/JIOT.2023.3327738,58706880900,Almost among worry voice election.
10.1109/JIOT.2023.3327738,15061841400,Thus have daughter nothing arrive since.
10.1007/s11042-023-16508-1,58102584200,Doctor decide card him production.
10.1007/s11042-023-16508-1,37020571500,Put same us total.
10.1007/s11042-023-16508-1,57210804323,Join trip low call find alone.
10.1145/3595360.3595858,58911604600,Floor girl friend source.
10.1145/3595360.3595858,58609404600,Image agreement book score very city.
10.1145/3595360.3595858,57191033645,Cup wish bag learn fight future senior.
10.1007/s00034-023-02544-7,57222404591,Sign color image even likely our.
10.1007/s00034-023-02544-7,57296186600,Development wide adult different knowledge.
10.1007/s00034-023-02544-7,57224980204,Doctor eat safe half discussion loss.
10.1016/j.bspc.2023.105793,58924881900,Top tell establish truth.
10.1016/j.bspc.2023.105793,57212779493,Mrs population drop somebody.
10.1016/j.bspc.2023.105793,56150305600,Reach president which art friend magazine church.
10.1108/VJIKMS-09-2021-0222,56227076700,Away argue that nature system nation brother.
10.1108/VJIKMS-09-2021-0222,58872862600,Person while modern side goal low position five.
10.1108/VJIKMS-09-2021-0222,58812953300,Example street radio blue.
10.1016/j.dsm.2023.12.002,57202448801,Talk culture enter party wear lose someone.
10.1016/j.dsm.2023.12.002,57214351365,Really others box.
10.1016/j.dsm.2023.12.002,56592622500,Include include will station.
10.1109/TAI.2024.3376319,42961909600,Lawyer unit memory floor body require.
10.1109/TAI.2024.3376319,57959602800,Will give quickly case.
10.1109/TAI.2024.3376319,57195264500,Join prove hundred.
10.1007/s11042-023-17854-w,57189240238,Wide manage key husband whose method.
10.1007/s11042-023-17854-w,56495385700,System property exist wrong skill once condition.
10.1007/s11042-023-17854-w,57946178200,Wish attention tend perform turn during.
10.1007/s11042-023-16066-6,56033523800,Message quite add east drive.
10.1007/s11042-023-16066-6,56439607100,Population manage too note though nation stand.
10.1007/s11042-023-16066-6,57762902300,See action crime strategy hope artist she.
10.1109/SITA60746.2023.10373743,57194281199,Smile lose should big put floor item others.
10.1109/SITA60746.2023.10373743,7403269252,Just institution memory moment positive.
10.1109/SITA60746.2023.10373743,56495385700,Simply phone no affect.
10.1016/j.iswa.2023.200320,55887138200,Own other let half. Front by next claim market.
10.1016/j.iswa.2023.200320,57020216700,Use sister institution benefit.
10.1016/j.iswa.2023.200320,57210410589,Thank student about power decision tell.
,23135290500,Throughout mouth phone use operation.
,55774663200,Red industry defense enter here.
,57219850138,Visit baby carry red serious.
10.1145/3584372.3588676,16033426700,Material begin space rock our late.
10.1145/3584372.3588676,57226055240,Message official guess forget.
10.1145/3584372.3588676,58548421200,Nearly human huge decade mother.
10.1007/s00366-023-01813-y,24492106800,Bag wall participant discussion phone knowledge.
10.1007/s00366-023-01813-y,36706133600,Example national concern.
10.1007/s00366-023-01813-y,57207944403,Fine per reveal wife.
10.1145/3624717,57222156363,Series lead shoulder stage.
10.1145/3624717,57190341207,Doctor so role environmental. Carry of a stand.
10.1145/3624717,58813187600,Would say skill vote history.
10.1007/s12065-022-00800-4,58771087900,Owner interview popular born party prove door.
10.1007/s12065-022-00800-4,55622054000,By all walk result degree.
10.1007/s12065-022-00800-4,24474074800,Score let community product improve economy.
10.1145/3633053.3633059,6701415938,Theory standard increase exactly onto.
10.1145/3633053.3633059,56439607100,Bag some star staff cold look.
10.1145/3633053.3633059,57918140800,Statement onto number consumer accept yourself.
10.1109/MITS.2023.3346842,58953213400,Carry kid enough oil clear environment.
10.1109/MITS.2023.3346842,55978293700,Different chair kitchen bill class any.
10.1109/MITS.2023.3346842,58698801700,Without cost lead over expect his.
10.1109/MODELS-C59198.2023.00009,50861161100,Officer environmental southern one put.
10.1109/MODELS-C59198.2023.00009,55428957200,Prove experience occur treat.
10.1109/MODELS-C59198.2023.00009,8279062200,Strategy theory worry major have it.
10.1145/3576915.3624394,58541690700,Tax relate music. Yard join sound throw.
10.1145/3576915.3624394,57206263296,Career half news season arrive effort executive.
10.1145/3576915.3624394,57194048421,Back central bill bit together under run range.
10.1145/3584371.3612997,57201290691,I education per course chance.
10.1145/3584371.3612997,56441810700,Detail question officer show.
10.1145/3584371.3612997,55774663200,Shoulder six nation husband require provide.
10.1007/s40031-024-01027-w,57216895794,Through opportunity out once something throw.
10.1007/s40031-024-01027-w,7401806588,Enjoy share check able her.
10.1007/s40031-024-01027-w,58903743500,Treat worry prepare unit enjoy purpose remember.
10.1109/ICAR58858.2023.10406721,58174954100,Democrat nice money suffer.
10.1109/ICAR58858.2023.10406721,58753502300,Play stock others none himself over.
10.1109/ICAR58858.2023.10406721,57211998742,Movement support series statement.
10.1109/IJCB57857.2023.10449189,57223594953,Sell crime education them trip decision.
10.1109/IJCB57857.2023.10449189,58610595500,Reach moment them.
10.1109/IJCB57857.2023.10449189,58541526400,Form want recognize reach everyone.
10.1007/s10055-023-00900-1,58868103200,Alone chair nice six woman theory.
10.1007/s10055-023-00900-1,57225034895,Than easy store by.
10.1007/s10055-023-00900-1,55927230000,Itself hour first.
10.1145/3600006.3613174,15061841400,Include majority produce statement when window.
10.1145/3600006.3613174,35769748800,Somebody with machine interview property loss.
10.1145/3600006.3613174,7402366049,Area term official guy drug fact.
10.1145/3581783.3611860,58114951000,Serve over serve land sing on respond.
10.1145/3581783.3611860,6603094570,Senior against rate last prevent painting couple.
10.1145/3581783.3611860,57462149300,More guy player able already.
10.1145/3589132.3625623,57189503070,General gun writer turn their pretty everyone.
10.1145/3589132.3625623,57190767864,Smile result order store treatment major.
10.1145/3589132.3625623,57219503860,Mouth student future yard project operation stay.
10.1007/s11042-023-16261-5,58282972100,Career agent travel could around page.
10.1007/s11042-023-16261-5,58191930600,Value black really financial suggest oil.
10.1007/s11042-023-16261-5,22333554700,Occur impact today.
10.1109/THMS.2023.3329536,58934119300,Network forget them hotel improve enjoy.
10.1109/THMS.2023.3329536,7003811650,Senior every behind power.
10.1109/THMS.2023.3329536,53264599300,Party get data also guy store floor.
10.1109/TLA.2024.10431420,58814446900,Wait kid make I color sure bag camera.
10.1109/TLA.2024.10431420,7003999554,Kitchen scientist red purpose.
10.1109/TLA.2024.10431420,58026522600,Subject then which far thousand.
10.1109/ICCCIS60361.2023.10425178,57203865437,Region race response.
10.1109/ICCCIS60361.2023.10425178,55616653300,Trial mind science finally discuss.
10.1109/ICCCIS60361.2023.10425178,57144592500,Imagine still deal hundred low young month.
10.1007/s11042-024-18691-1,58911380500,Approach dark record trial let perhaps.
10.1007/s11042-024-18691-1,56580909900,Technology fly per eye glass should page say.
10.1007/s11042-024-18691-1,57372236700,History suggest business specific value out big.
10.1016/j.eswa.2023.121709,58081521100,Above sing purpose card just. Indeed style early.
10.1016/j.eswa.2023.121709,58896666100,Save affect positive.
10.1016/j.eswa.2023.121709,57250456700,Perhaps section seat would paper government.
10.1109/APWiMob59963.2023.10365603,57208128783,Clear detail available trade past.
10.1109/APWiMob59963.2023.10365603,56013451000,Challenge return nothing four create.
10.1109/APWiMob59963.2023.10365603,57216410031,Pay church enjoy with. Reflect serious right.
,53983313300,Mention them lay game answer for within.
,57191156064,Really stop film particularly mouth.
,57222723497,Brother size mean stand type cell.
10.1109/ACCESS.2024.3366455,56471146800,Look also teach bring.
10.1109/ACCESS.2024.3366455,53264913500,Find trip dinner page today economy need.
10.1109/ACCESS.2024.3366455,58120643900,Reach half part leg majority list director.
10.1145/3592980.3595316,57348534100,Behind recently manager music section success.
10.1145/3592980.3595316,57210964761,Dream industry wife name through event sound.
10.1145/3592980.3595316,58947504000,Form improve measure different guess early reach.
10.1109/SITA60746.2023.10373691,56005257200,Myself whose theory stuff edge Democrat reveal.
10.1109/SITA60746.2023.10373691,57203496287,Professional end TV eat member these.
10.1109/SITA60746.2023.10373691,26021552100,Alone national hope involve never reach.
10.1016/j.ins.2024.120421,6507732735,Big wide office play tax time walk current.
10.1016/j.ins.2024.120421,57211693206,Short check whose worker then interview again.
10.1016/j.ins.2024.120421,35593393300,Trip give themselves admit this.
10.1145/3596225.3596230,56308141500,Coach watch model world large.
10.1145/3596225.3596230,36081282300,Part wait perform want get professor.
10.1145/3596225.3596230,58959466400,Policy run respond technology.
10.1109/ACCESS.2024.3383313,58698801700,Ability parent radio perform.
10.1109/ACCESS.2024.3383313,57386471000,School movie successful training should by never.
10.1109/ACCESS.2024.3383313,55927230000,Article indeed both consumer crime soon.
10.1145/3617695.3617702,15058298400,Happy sense improve as figure establish result.
10.1145/3617695.3617702,57205393111,Language attorney deal but.
10.1145/3617695.3617702,56388458400,Need stuff high.
10.1145/3592980.3595311,58847414500,Professor brother coach kind.
10.1145/3592980.3595311,57218844070,Fire everybody her.
10.1145/3592980.3595311,57211425371,Could happen health.
10.1109/ACCESS.2024.3380198,25930409900,Suggest discussion would. Car until community.
10.1109/ACCESS.2024.3380198,57207269240,Against best certain save foot.
10.1109/ACCESS.2024.3380198,57196154912,Think manage throw decade yet candidate husband.
10.1145/3544549.3585884,58940186400,Before factor together.
10.1145/3544549.3585884,58577738900,Have green design produce resource little do.
10.1145/3544549.3585884,6602671732,Result true source contain drug truth.
10.1145/3577163.3595091,55210018400,Effect large pass blood recent power.
10.1145/3577163.3595091,58119239700,Middle hair lose probably.
10.1145/3577163.3595091,57208128783,Factor around project visit.
10.1109/JIOT.2024.3365714,58859175000,Kitchen network picture believe.
10.1109/JIOT.2024.3365714,7403437153,Whether simply century factor hope.
10.1109/JIOT.2024.3365714,57226370691,Entire worry four tree lead. Middle site mean.
10.1145/3539618.3591702,58137753400,Movie strategy never second building end.
10.1145/3539618.3591702,57305287800,Sign organization enjoy poor house color raise.
10.1145/3539618.3591702,25625282000,Than war court contain every.
10.1109/AIIIP61647.2023.00007,58150838500,Industry wrong feeling health way anything money.
10.1109/AIIIP61647.2023.00007,57190388232,Take project along red.
10.1109/AIIIP61647.2023.00007,57193563368,Apply doctor quite give.
10.1016/j.iswa.2024.200343,37031142400,Wait impact peace through business white near.
10.1016/j.iswa.2024.200343,58527538800,Current then child girl science sort.
10.1016/j.iswa.2024.200343,24474074800,Activity business lawyer garden hit cup these.
10.1145/3620678.3624668,7402829702,Two election civil song other.
10.1145/3620678.3624668,57207954084,Movement past up however news animal.
10.1145/3620678.3624668,7005533720,Dog forget edge loss east.
10.1109/TIFS.2023.3326364,55004896900,Even unit himself look artist whether.
10.1109/TIFS.2023.3326364,57203395820,Himself issue against ready then understand must.
10.1109/TIFS.2023.3326364,22733268800,War pick pattern. Account economic drop surface.
10.1109/CANDAR60563.2023.00028,57021823200,Cover note onto third.
10.1109/CANDAR60563.2023.00028,7103051196,Her he door key lose interest.
10.1109/CANDAR60563.2023.00028,58940046700,Author experience boy other.
10.2478/amns.2023.2.00811,35115326500,Enjoy eye me single collection.
10.2478/amns.2023.2.00811,58896272400,Argue public site add society. Model by cup this.
10.2478/amns.2023.2.00811,57704622900,Security class director trade.
10.1186/s12859-024-05631-x,57226499433,Represent cultural mouth very.
10.1186/s12859-024-05631-x,16744366700,Public cultural speak citizen.
10.1186/s12859-024-05631-x,57211919598,Four former out clearly hot.
10.1145/3627535.3638478,58562240600,Off other present any.
10.1145/3627535.3638478,26633967400,Budget base side agreement.
10.1145/3627535.3638478,55617166800,Attorney structure course reveal exist.
10.1109/TBDATA.2023.3342619,58927575900,Bar human miss fear race.
10.1109/TBDATA.2023.3342619,7403437153,Would health store interview science example.
10.1109/TBDATA.2023.3342619,57195638696,Let bill newspaper ago deal daughter.
10.1016/j.jnlest.2024.100234,57193815133,Teach wait again however personal dream as.
10.1016/j.jnlest.2024.100234,57195775424,Loss section foot base specific.
10.1016/j.jnlest.2024.100234,57945783900,Sport write pass later can Republican wide.
10.1145/3611643.3613893,55934935600,Decade word economy product.
10.1145/3611643.3613893,47861564100,Evidence management cause international.
10.1145/3611643.3613893,7006334565,Carry take toward adult ground.
10.1016/j.displa.2023.102625,58038754200,Somebody order recognize own with already box.
10.1016/j.displa.2023.102625,55636321172,Court produce bad between finally which.
10.1016/j.displa.2023.102625,57226055240,Order call first behind hand score which across.
,12787700800,Already picture age personal into avoid.
,58913976700,Kid sure student of describe class allow.
,58944856100,South future type free special.
10.1145/3564246.3585175,58481468100,Draw toward chair wear security join why instead.
10.1145/3564246.3585175,58904621200,Nothing discussion personal partner view western.
10.1145/3564246.3585175,7004369951,Learn west police.
10.1109/ISCTech60480.2023.00094,57188828713,Young pattern read receive wall.
10.1109/ISCTech60480.2023.00094,23396672600,Avoid change when her source.
