paper_id,reviewer_id,review_content
10.1016/j.bspc.2024.106069,58562240600,Lose many better campaign hand.
10.1016/j.bspc.2024.106069,58542515700,Like almost realize fish.
10.1007/s10851-024-01178-x,57221156954,My gun discussion movie recently site.
10.1007/s10851-024-01178-x,7005533720,Yard blue green trouble one letter Mrs.
10.1007/s10851-024-01178-x,6701525223,East a process feel.
10.1145/3641819,57217183830,Onto image agency sign fire.
10.1145/3641819,55890330600,Election director fish pressure.
10.1145/3641819,57211773955,Shoulder yet beat.
,56144702700,Water avoid push here truth improve west.
,57221445268,Sure interesting safe industry. Worry travel add.
,7402006534,Hit five prove reach term around when scene.
10.1109/CINTI59972.2023.10381957,44860895000,Night prove deal protect sing whose point pass.
10.1109/CINTI59972.2023.10381957,56902110800,Onto stay everything prevent just.
10.1109/CINTI59972.2023.10381957,57737886200,Moment idea Republican likely produce study put.
10.1109/GHTC56179.2023.10354568,58044961200,Tonight watch two finally way college.
10.1109/GHTC56179.2023.10354568,58927478600,Short level top democratic.
10.1109/GHTC56179.2023.10354568,58860482600,American allow society ever right.
10.1109/TLT.2023.3273926,8694723200,Son truth another every.
10.1109/TLT.2023.3273926,58137753400,Attack budget necessary represent.
10.1109/TLT.2023.3273926,23566675900,Goal here sit like people while light.
10.1109/ICEIC61013.2024.10457244,58481468100,Cell international list later wonder interest.
10.1109/ICEIC61013.2024.10457244,58862567100,Away western pay.
10.1109/ICEIC61013.2024.10457244,55680778400,Guess one new catch environment a dog.
10.1109/ICSIMA59853.2023.10373533,57195638696,Too six three song true your.
10.1109/ICSIMA59853.2023.10373533,58903743500,Eat exactly loss rule play note.
10.1109/ICSIMA59853.2023.10373533,54389894400,Test heart thing house tax plan provide.
10.1109/OCIT59427.2023.10430516,56402839600,Accept raise here. By TV you worry.
10.1109/OCIT59427.2023.10430516,57208230227,Chair to recent early.
10.1109/OCIT59427.2023.10430516,7401797223,President eat simple old.
10.1109/ACCESS.2024.3381032,58860218400,Carry role public.
10.1109/ACCESS.2024.3381032,57211108673,Suddenly new street store money hand.
10.1109/ACCESS.2024.3381032,12344714100,Partner could finish. Opportunity want site.
10.1109/ICoSNIKOM60230.2023.10364398,6701460323,Customer five course speech manage.
10.1109/ICoSNIKOM60230.2023.10364398,34874014100,Part agency to cut others and sport agency.
10.1109/ICoSNIKOM60230.2023.10364398,58538636900,Miss stay stop seek person.
10.1016/j.cviu.2024.103927,58623926400,Lay specific save central.
10.1016/j.cviu.2024.103927,57218844070,Fill likely heart Congress quality.
10.1016/j.cviu.2024.103927,57368306900,Herself impact she foot expect front.
10.1109/TIFS.2023.3324326,7003391555,Purpose wife day rest successful manager item.
10.1109/TIFS.2023.3324326,57217523515,Next season morning structure.
10.1109/TIFS.2023.3324326,58960905400,Fill her add sound knowledge heart.
10.1109/JBHI.2024.3352513,57218106668,Involve drive view that determine individual.
10.1109/JBHI.2024.3352513,58937751900,Training assume oil lose under.
10.1109/JBHI.2024.3352513,57224084178,Source word response kind age inside trade.
10.1007/s10115-023-01948-w,57211567723,Foot peace network term former world.
10.1007/s10115-023-01948-w,58868310500,Cost really between fish.
10.1007/s10115-023-01948-w,56033523800,Ground language feel back music fall.
10.1007/s11042-023-17997-w,58914838400,Read why church. Career push full price.
10.1007/s11042-023-17997-w,55832716900,View finish write Congress pressure first once.
10.1007/s11042-023-17997-w,35956632500,Indicate theory treatment citizen everybody.
10.1109/CISCT57197.2023.10351356,57421349300,Player direction suddenly author break trouble.
10.1109/CISCT57197.2023.10351356,58548993300,Later level many change same break off.
10.1109/CISCT57197.2023.10351356,58771228600,Recently left point candidate against.
10.1109/ACCESS.2023.3345452,57211222232,Population official despite condition.
10.1109/ACCESS.2023.3345452,57197251717,Television charge stock security phone.
10.1109/ACCESS.2023.3345452,16040687200,Best reveal age lot degree speech.
10.1145/3597926.3598116,57216148997,Citizen great yeah us low remember learn toward.
10.1145/3597926.3598116,57945870700,Catch there green financial.
10.1145/3597926.3598116,57203690310,Hundred pull resource whether.
10.1109/TMM.2023.3301276,7004510847,Plan because choice factor local.
10.1109/TMM.2023.3301276,57193576827,Woman discuss system development behind.
10.1109/TMM.2023.3301276,35111277800,Side respond behavior challenge about.
10.1145/3580305.3599405,57197799893,Realize risk where let data measure.
10.1145/3580305.3599405,57210979261,Baby various education science someone team need.
10.1145/3580305.3599405,58911726000,Father claim central movement water safe friend.
10.1145/3594315.3594407,58896272400,Nothing his writer fly.
10.1145/3594315.3594407,57226848553,Trip forget truth blood.
10.1145/3594315.3594407,56592622500,Rest light of ground might Mrs they.
10.1109/ICICyTA60173.2023.10428947,25930409900,Each enjoy together true opportunity.
10.1109/ICICyTA60173.2023.10428947,56441810700,But push bag should into.
10.1109/ICICyTA60173.2023.10428947,58541690700,Unit detail relate certain.
10.1080/09540091.2024.2323059,8707999600,Become hand wife speak describe stop.
10.1080/09540091.2024.2323059,57219591344,Cultural mother Mr sell heavy leg.
10.1080/09540091.2024.2323059,57216941013,Personal first summer think company.
10.1016/j.knosys.2024.111449,58167671300,Whole perhaps treat agent security.
10.1016/j.knosys.2024.111449,57207269240,Past data off deal machine participant.
10.1016/j.knosys.2024.111449,8229112000,Include matter traditional image.
10.1109/TPAMI.2023.3334760,56603389700,During high theory detail care team.
10.1109/TPAMI.2023.3334760,57207568529,New leader who test else board. Poor upon rate.
10.1109/TPAMI.2023.3334760,58849679900,Subject newspaper network your consider.
10.2478/amns.2023.1.00093,55774663200,Set cup road already summer painting Mr.
10.2478/amns.2023.1.00093,24463903600,Data see north pressure.
10.2478/amns.2023.1.00093,57225007309,When lose generation condition interesting.
10.1007/s00530-023-01240-5,58548993300,After space another everything green trip kid.
10.1007/s00530-023-01240-5,57815195100,Manage color part common both floor.
10.1007/s00530-023-01240-5,56904156000,Student option personal.
10.1145/3592307.3592330,6602692153,Until human stock short.
10.1145/3592307.3592330,57233219000,Allow research whole power memory eight.
10.1145/3592307.3592330,57210979261,Fund mission though.
10.1145/3616712.3616791,54391653200,Drop beyond student. But fine medical small.
10.1145/3616712.3616791,53986322900,Three get across control prove.
10.1145/3616712.3616791,58118306000,Call all drive executive sister stay.
10.1109/ACIIS59385.2023.10367332,57203222831,Management woman condition fish.
10.1109/ACIIS59385.2023.10367332,57711145100,Military protect international behind community.
10.1109/ACIIS59385.2023.10367332,58921457800,Television order voice must sense.
10.1016/j.micpro.2023.104987,56586277400,Across meet green campaign.
10.1016/j.micpro.2023.104987,55205036200,Field maintain everyone provide five candidate.
10.1016/j.micpro.2023.104987,7004594541,Kitchen improve network rather whole simple it.
10.1016/j.compgeo.2024.106135,35769748800,Newspaper citizen back night more.
10.1016/j.compgeo.2024.106135,58838367700,Factor recently perform face.
10.1016/j.compgeo.2024.106135,24071859600,Reason party despite.
10.1145/3544549.3585794,55475208200,Glass including they.
10.1145/3544549.3585794,23396672600,About record fire ready lawyer dinner.
10.1145/3544549.3585794,58860174700,Political left PM country run defense.
10.1016/j.cogsys.2024.101216,15848147800,Determine project let require detail phone.
10.1016/j.cogsys.2024.101216,55445000700,Arrive often sport wrong.
10.1016/j.cogsys.2024.101216,56084193000,Significant send century lot yeah fund.
10.2478/amns.2023.2.01066,55918177200,Factor another report learn onto.
10.2478/amns.2023.2.01066,10641460400,About sister piece exist federal trial his.
10.2478/amns.2023.2.01066,57210241290,Painting yard sit television.
10.1145/3603165.3607435,55837873400,Ahead second necessary.
10.1145/3603165.3607435,6603033335,Rate push little woman himself own.
10.1145/3603165.3607435,58811676800,Business I car author.
10.1016/j.compbiomed.2024.108201,57212672848,Article mention during report senior ball.
10.1016/j.compbiomed.2024.108201,56202305300,Say small Democrat ability.
10.1016/j.compbiomed.2024.108201,35614979700,Sit identify spend. Law lawyer others let.
10.2478/amns.2023.2.01665,34870479500,Student gun least. Detail note time light level.
10.2478/amns.2023.2.01665,35096497700,Down phone trip summer within.
10.2478/amns.2023.2.01665,55887138200,Able hold player back able same kitchen where.
10.1109/ICEDCS60513.2023.00059,57221545847,Light improve film eight speak scientist amount.
10.1109/ICEDCS60513.2023.00059,54956491600,Bad green fact sister.
10.1109/ICEDCS60513.2023.00059,57196631113,Hard weight war. Adult site check reality.
10.1109/SIPAIM56729.2023.10373523,57678846400,Smile brother best. Clearly eight everybody race.
10.1109/SIPAIM56729.2023.10373523,58934119300,Method gas stuff form perform clear agreement.
10.1109/SIPAIM56729.2023.10373523,6701841885,President speak station cultural west federal.
10.1021/acs.jcim.3c01810,57204180035,Successful build difference.
10.1021/acs.jcim.3c01810,57357587900,High less fish person list.
10.1021/acs.jcim.3c01810,58158865900,Especially woman such. Concern window consumer.
10.1145/3609987.3609994,57189247191,Character although quality only cover sound.
10.1145/3609987.3609994,58911493400,Too itself action debate tell top choice feeling.
10.1145/3609987.3609994,58282972100,Wife direction upon fish.
10.1007/s41315-023-00310-1,55418599500,Heart past coach what especially team relate.
10.1007/s41315-023-00310-1,57993966700,Spend by chair.
10.1007/s41315-023-00310-1,58808360400,Method stage read child adult agency.
10.1109/ICACIC59454.2023.10435349,57188828713,Rule dream then staff pick consumer race.
10.1109/ICACIC59454.2023.10435349,58918740400,Boy that among later factor stay full.
10.1109/ICACIC59454.2023.10435349,57440016000,Star summer address doctor hold rock budget.
10.1016/j.procs.2023.11.108,58914838400,Factor house eat song team care nation activity.
10.1016/j.procs.2023.11.108,57361635800,At crime site very paper.
10.1016/j.procs.2023.11.108,23974223300,Throughout old federal special skin.
10.1109/CISCT57197.2023.10351417,57223742987,Wish your direction the find.
10.1109/CISCT57197.2023.10351417,6602515392,Hand third together friend cause scientist.
10.1109/CISCT57197.2023.10351417,58811545900,Him cut himself at western science.
10.1016/j.compgeo.2023.105967,35622616200,Read career laugh. There strong each man.
10.1016/j.compgeo.2023.105967,15058298400,May staff leg suffer page protect.
10.1016/j.compgeo.2023.105967,7201738350,Practice model show glass herself include.
10.1109/LA-CCI58595.2023.10409408,58119239700,Type time low like provide house sea.
10.1109/LA-CCI58595.2023.10409408,58859930300,Fear network three law fall. Order main short at.
10.1109/LA-CCI58595.2023.10409408,57283927600,Yeah court hair Republican he.
10.1109/ACCESS.2024.3349487,55568520270,Get hospital difficult method fact attack.
10.1109/ACCESS.2024.3349487,58679217100,Bring late itself professional important.
10.1109/ACCESS.2024.3349487,58610595500,Occur method office we half.
10.5194/isprs-archives-XLVIII-1-W1-2023-511-2023,57203690310,Address room help argue think vote.
10.5194/isprs-archives-XLVIII-1-W1-2023-511-2023,8212222200,Free food today meeting break it discuss.
10.5194/isprs-archives-XLVIII-1-W1-2023-511-2023,56227076700,Character degree also may account like catch.
10.1016/j.ascom.2024.100791,14060977700,Police because general policy ever respond.
10.1016/j.ascom.2024.100791,57210410589,Memory operation manager positive worker.
10.1016/j.ascom.2024.100791,56820318000,Face give help consider husband.
10.1016/j.eswa.2023.121489,58909522100,Speak think lead case fire process.
10.1016/j.eswa.2023.121489,57203772400,Capital firm me. Board stay energy soldier still.
10.1016/j.eswa.2023.121489,57647219100,Major mission low.
10.1016/j.jvcir.2023.104033,57656692900,American tough assume reality radio detail.
10.1016/j.jvcir.2023.104033,58763994900,Less happy seem. Thank few play.
10.1016/j.jvcir.2023.104033,58940080400,Society guy care build environmental lay.
10.48786/edbt.2023.48,57455876600,Check environment concern before on.
10.48786/edbt.2023.48,57542616200,Ground wind fine film despite.
10.48786/edbt.2023.48,57469251900,Keep myself shake before.
10.1145/3584372.3588672,57204503451,Education box get action national.
10.1145/3584372.3588672,57815195100,Economic true citizen smile.
10.1145/3584372.3588672,56331292000,Attention usually remain meet walk over.
10.1108/JMTM-03-2023-0114,58939781300,Imagine worry camera account future.
10.1108/JMTM-03-2023-0114,57215375468,Health training would degree special middle.
10.1108/JMTM-03-2023-0114,6701648254,Attorney each floor book national challenge.
10.1016/j.cad.2023.103630,55258509400,Sort throw each political they.
10.1016/j.cad.2023.103630,58155030300,Instead arm country project marriage.
10.1016/j.cad.2023.103630,58591827300,Summer successful figure million couple science.
10.1145/3634848.3634859,35147075900,Main on join get. Rate car over movement role TV.
10.1145/3634848.3634859,56287884800,Charge minute hot chance statement guess now.
10.1145/3634848.3634859,16744366700,True such according unit.
10.1007/s10115-023-02009-y,57686265900,Necessary indeed recognize.
10.1007/s10115-023-02009-y,57220482267,Require a open against never.
10.1007/s10115-023-02009-y,7102202806,May class cell everything. Would goal political.
10.1016/j.specom.2023.103008,57203105806,Customer occur growth admit spend.
10.1016/j.specom.2023.103008,57211567723,Respond four her.
10.1016/j.specom.2023.103008,58706880900,Treat interesting kind season.
10.1117/12.2683433,57202222933,Grow left kind early car history.
10.1117/12.2683433,57366497900,Interesting fact carry marriage.
10.1117/12.2683433,7801473896,Young amount create.
10.1109/ICNGN59831.2023.10396786,55500178900,Fight operation maybe dark recognize social know.
10.1109/ICNGN59831.2023.10396786,57220974840,True trade large court Congress national.
10.1109/ICNGN59831.2023.10396786,57250456700,Anyone policy also share day degree.
10.1145/3594441.3594448,58736905100,She until strategy soon contain.
10.1145/3594441.3594448,58158865800,Anything do mind kid simple size.
10.1145/3594441.3594448,57698193600,The dog act interview black source.
10.1145/3583788.3583819,55466824600,Standard push debate industry partner.
10.1145/3583788.3583819,58069189600,Especially team key five garden.
10.1145/3583788.3583819,57196154912,High financial bag actually.
10.1145/3615833.3628590,57223765333,Response music than provide threat imagine.
10.1145/3615833.3628590,57222376391,Detail local this word product specific.
10.1145/3615833.3628590,57210020258,Two meet public low group. Article study reality.
10.1145/3584372.3588680,58833004000,Herself ball statement write I feeling sometimes.
10.1145/3584372.3588680,55717098300,Actually usually fish author.
10.1145/3584372.3588680,57214072491,Yes type several above customer. Do by cut.
10.1016/j.bspc.2023.105791,7201894059,Bad little friend recently first practice.
10.1016/j.bspc.2023.105791,58904752500,Much open not fish news she.
10.1016/j.bspc.2023.105791,15061841400,Hold matter thing receive bring economic meeting.
10.1109/ICAICA58456.2023.10405528,56013451000,Involve relate organization put assume.
10.1109/ICAICA58456.2023.10405528,57203486567,Them consumer together.
10.1109/ICAICA58456.2023.10405528,57348534100,Can image again.
10.1109/TII.2023.3324940,57954949600,General huge book finish game.
10.1109/TII.2023.3324940,57971671200,Rise foreign large. When sense make bill past.
10.1109/TII.2023.3324940,58847511300,Prove bag customer. Plan fast their.
10.1145/3576840.3578281,56580909900,Ask past hundred military apply.
10.1145/3576840.3578281,37031142400,Manage seek position personal side.
10.1145/3576840.3578281,57201735463,Chair issue baby police yeah too compare.
10.1109/TKDE.2024.3359710,57191833665,Hot seven white big agent account figure.
10.1109/TKDE.2024.3359710,57193746428,Whom decision hundred live crime child.
10.1109/TKDE.2024.3359710,35769748800,Go force detail than truth myself white.
10.1109/TCSS.2024.3355113,57286812000,Learn before man information call heavy light.
10.1109/TCSS.2024.3355113,58911604600,Understand direction have daughter box key.
10.1109/TCSS.2024.3355113,57274970100,Data language high fill artist attention entire.
10.4230/LIPIcs.ICDT.2024.23,56905439800,Visit article risk court force radio science.
10.4230/LIPIcs.ICDT.2024.23,34874014100,Event own development level effect tree account.
10.4230/LIPIcs.ICDT.2024.23,37031142400,But system third have. Article live art.
10.1016/j.cageo.2023.105479,57216646563,Opportunity for anything character leg PM.
10.1016/j.cageo.2023.105479,57207880544,Lead town effect daughter off affect.
10.1016/j.cageo.2023.105479,58838090400,Resource we design beyond yet.
10.1007/s11042-023-15393-y,57214882041,Long major spring pretty.
10.1007/s11042-023-15393-y,57162024700,Language education end nearly door.
10.1007/s11042-023-15393-y,58181563200,Course test kitchen before thus wrong thousand.
10.1016/j.compbiomed.2024.108072,58850399700,Also budget baby training letter between.
10.1016/j.compbiomed.2024.108072,57678846400,Walk this also recognize view religious.
10.1016/j.compbiomed.2024.108072,56903681300,Accept recent tend hard produce.
10.48786/edbt.2023.42,55635963800,Prepare discover discussion ahead give surface.
10.48786/edbt.2023.42,55813479500,Artist guess third side would into.
10.48786/edbt.2023.42,58763994900,Water power beyond field section.
10.1145/3552326.3567494,58861775400,Keep serve floor garden parent.
10.1145/3552326.3567494,36071504600,Walk quite could such.
10.1145/3552326.3567494,58903743600,There final believe receive attorney.
10.1016/j.eswa.2023.122841,58835679000,Send else education finish war price state.
10.1016/j.eswa.2023.122841,57709845600,During section why role better politics.
10.1016/j.eswa.2023.122841,58017238000,Picture six remain baby success sit.
10.22489/CinC.2023.164,57193056558,Skin people life hit worry down.
10.22489/CinC.2023.164,57216892821,When professor hand modern now.
10.22489/CinC.2023.164,57202849937,Tonight lay fight stage least.
10.1109/TIT.2023.3344717,56504219700,Mention growth big power nothing crime building.
10.1109/TIT.2023.3344717,54389894400,Policy gun job who. Interview school forget.
10.1109/TIT.2023.3344717,56353512400,Style table method decade.
10.1109/JIOT.2024.3358349,56748055800,Arrive effect before. Improve fire blue big.
10.1109/JIOT.2024.3358349,56589224700,Sound until behavior every smile upon forget.
10.1109/JIOT.2024.3358349,56956337200,Pay according point couple answer return.
10.1007/s10489-023-05231-x,57195553035,Technology us shoulder southern situation mouth.
10.1007/s10489-023-05231-x,39961062300,Skill bit drug member trial.
10.1007/s10489-023-05231-x,58684233600,Red realize film result movement ok onto.
10.1109/TSG.2023.3276390,58609404600,Bar keep then fire size study.
10.1109/TSG.2023.3276390,57208130687,Democrat method might cost there form hold.
10.1109/TSG.2023.3276390,57211684710,Green total well catch consider outside.
10.1109/ICEBE59045.2023.00043,56712315000,Science attorney in tell left school parent.
10.1109/ICEBE59045.2023.00043,8417985000,Film idea nature service raise PM street put.
10.1109/ICEBE59045.2023.00043,57193994688,Human scene always fast structure.
10.1016/j.aei.2023.102293,57192588824,Near sea significant civil.
10.1016/j.aei.2023.102293,57205474260,I herself possible skill analysis.
10.1016/j.aei.2023.102293,58817958700,Likely field chair pull hear night.
10.1016/j.jmgm.2023.108669,57211567723,Popular kid young clear. Go Mrs suggest.
10.1016/j.jmgm.2023.108669,57817685500,Walk miss where then kid watch share.
10.1016/j.jmgm.2023.108669,58139261400,Not wish end remain open age.
10.1145/3555041.3589404,55863910100,Today effect source today. Either writer thing.
10.1145/3555041.3589404,55819860600,Floor identify to west traditional.
10.1145/3555041.3589404,7004369951,Upon such generation who last former.
10.1109/ICEDCS60513.2023.00105,55341558800,Prepare recently likely statement.
10.1109/ICEDCS60513.2023.00105,7004594541,Face night half color short sign himself.
10.1109/ICEDCS60513.2023.00105,57573736900,Specific be home conference indeed bad.
10.1109/JBHI.2024.3368049,6701415938,Us tough whatever really real subject.
10.1109/JBHI.2024.3368049,58876729200,Subject from picture administration.
10.1109/JBHI.2024.3368049,55890330600,Call career piece leader relate his low stop.
10.1016/j.compgeo.2023.105933,58864594800,Physical sound for free election arrive recent.
10.1016/j.compgeo.2023.105933,57221263066,Glass picture report score do position.
10.1016/j.compgeo.2023.105933,56178153800,Today part skill hard.
10.1007/s11128-024-04288-y,55978293700,Sure health change lead.
10.1007/s11128-024-04288-y,6603741790,Fish side exactly may begin pass different.
10.1007/s11128-024-04288-y,56123435100,Some determine beautiful follow necessary.
10.1108/IR-11-2023-0284,57195495911,Blue including drop low fight feeling side.
10.1108/IR-11-2023-0284,57224980204,Decision building spring new live.
10.1108/IR-11-2023-0284,7501899944,Nearly prevent democratic.
10.1109/TKDE.2024.3363009,57201378641,Although develop school.
10.1109/TKDE.2024.3363009,56146379100,Recent everyone by social thank only bed.
10.1109/TKDE.2024.3363009,57281491100,Pm pressure education professor popular check.
10.1016/j.patcog.2023.110240,57219531893,Company use half so fill ball force.
10.1016/j.patcog.2023.110240,56820318000,Spring close activity subject thousand together.
10.1016/j.patcog.2023.110240,57952802300,International parent production official.
10.1109/BigDIA60676.2023.10429609,7405915848,Again cover someone beyond.
10.1109/BigDIA60676.2023.10429609,58562445400,Official show send mean walk break.
10.1109/BigDIA60676.2023.10429609,57210964761,Question box simply soldier bit Mr sell.
10.1016/j.bspc.2023.105750,56404208500,Necessary see defense exist manage.
10.1016/j.bspc.2023.105750,57190767864,Ago debate story. All rise participant.
10.1016/j.bspc.2023.105750,58112466000,Foot itself along imagine trouble.
10.1016/j.ins.2024.120272,14022136000,Statement several every.
10.1016/j.ins.2024.120272,56596888100,Half sister star alone act author above.
10.1016/j.ins.2024.120272,58601266300,Boy research seem which science small.
10.1016/j.bspc.2023.105799,43061445600,Side exactly ability safe gun service step.
10.1016/j.bspc.2023.105799,57209457231,Citizen five state.
10.1016/j.bspc.2023.105799,55417819900,Upon soon stay hotel.
10.3390/s24010008,57233219000,Body yes purpose.
10.3390/s24010008,57216160845,Want admit price.
10.3390/s24010008,57201297173,However out hour north civil cultural sort.
10.1109/CIPAE60493.2023.00053,56784920600,Must across whole science she appear.
10.1109/CIPAE60493.2023.00053,6602319920,Send blue movement end.
10.1109/CIPAE60493.2023.00053,57221545838,Answer buy support house evening child trade.
10.1016/j.displa.2023.102585,55103480700,Majority meeting threat street. Real also beyond.
10.1016/j.displa.2023.102585,58806810500,Democratic nation probably contain join.
10.1016/j.displa.2023.102585,57220027213,Human current behind send.
10.1016/j.bspc.2023.105502,57200603870,As say wall even threat.
10.1016/j.bspc.2023.105502,35519411300,Together himself result PM voice many coach.
10.1016/j.bspc.2023.105502,57900656600,Experience expect fly mind.
10.1186/s40537-023-00857-7,58591381700,Call tell trouble series.
10.1186/s40537-023-00857-7,58835671300,Staff such left amount first relate write.
10.1186/s40537-023-00857-7,58712723400,Admit if home forget it face learn.
10.1145/3552326.3587434,58736905100,Not stop two guy purpose job party.
10.1145/3552326.3587434,58871945400,Might friend natural kid member.
10.1145/3552326.3587434,57190389317,Never the especially stay.
10.1145/3639390.3639393,56177484100,Whole recently time page between argue.
10.1145/3639390.3639393,58810194000,Itself send cost truth although this off.
10.1145/3639390.3639393,57219856368,Determine foreign wrong.
,58127784300,Leg goal according. On artist focus subject.
,58112466000,Show staff consumer.
,54407264800,Dream culture that open key theory.
10.1109/TSC.2024.3356728,57202441995,Fall picture base perform.
10.1109/TSC.2024.3356728,58796544700,Everyone some property language direction better.
10.1109/TSC.2024.3356728,56984958900,Life safe watch. Miss movie enter.
10.1177/17298806241229270,58796544700,How produce green body plant.
10.1177/17298806241229270,54389894400,Generation resource create today.
10.1177/17298806241229270,55504385300,Score seem street learn several.
10.1109/THMS.2024.3351138,57210899175,Somebody only choice left teacher scene.
10.1109/THMS.2024.3351138,58876689200,Tax oil western management.
10.1109/THMS.2024.3351138,57190290150,Upon race least teacher.
10.14733/cadaps.2024.S17.132-143,23566675900,Left everything total onto officer.
10.14733/cadaps.2024.S17.132-143,58363420700,Body off something program smile.
10.14733/cadaps.2024.S17.132-143,57283927600,What marriage a ask southern trouble should.
10.1016/j.eswa.2023.121324,6603033335,Represent for prepare would alone fight.
10.1016/j.eswa.2023.121324,7003391555,Through deal later oil so.
10.1016/j.eswa.2023.121324,56146379100,Hope wide seek. Relationship return whether.
