start_id,end_id
"18th International Conference on Tangible, Embedded, and Embodied Interaction, TEI 2024",ACM International Conference Proceeding Series
"2023 Young Scholar Symposium on Science Education, Earth, and Environment, YSSSEE 2023",E3S Web of Conferences
"26th Australasian Computing Education Conference, ACE 2024 - Held in conjunction with Australasian Computer Science Week",ACM International Conference Proceeding Series
"17th Innovations in Software Engineering Conference,  ISEC 2024",ACM International Conference Proceeding Series
"32nd EACSL Annual Conference on Computer Science Logic, CSL 2024","Leibniz International Proceedings in Informatics, LIPIcs"
"1st International Conference on Engineering, Medicine, Management, Arts and Sciences 2021, EMMA 2021",AIP Conference Proceedings
"46th IEEE/ACM International Conference on Software Engineering, ICSE 2024",Proceedings - International Conference on Software Engineering
